subreddit,title,score,url,author,created_utc,extracted_at
sysadmin,Why are my senior coworkers suddenly giving up?,274,https://www.reddit.com/r/sysadmin/comments/1lp92t1/why_are_my_senior_coworkers_suddenly_giving_up/,TrueMythos,2025-07-01 18:16:18,2025-07-02 10:34:10.005183
sysadmin,Might need CJIS cert -- Expunged criminal record?,9,https://www.reddit.com/r/sysadmin/comments/1lpvpiz/might_need_cjis_cert_expunged_criminal_record/,an0therburn4racc0810,2025-07-02 13:21:07,2025-07-02 10:34:10.005183
sysadmin,Company hires IT without knowing where they belong in the budget...is this normal?,96,https://www.reddit.com/r/sysadmin/comments/1lpgmnq/company_hires_it_without_knowing_where_they/,Mindless_Software_99,2025-07-01 23:20:43,2025-07-02 10:34:10.005183
sysadmin,Did anyone else's company CEO give junk to the IT department?,330,https://www.reddit.com/r/sysadmin/comments/1lp4dn8/did_anyone_elses_company_ceo_give_junk_to_the_it/,kirsion,2025-07-01 15:18:48,2025-07-02 10:34:10.005183
sysadmin,Locking down Windows 11 24H2 for domain user,6,https://www.reddit.com/r/sysadmin/comments/1lpu7sd/locking_down_windows_11_24h2_for_domain_user/,Odd_Entertainer4930,2025-07-02 12:11:46,2025-07-02 10:34:10.005183
sysadmin,Identifying device from its MAC address,20,https://www.reddit.com/r/sysadmin/comments/1lpncfq/identifying_device_from_its_mac_address/,Recent_Carpenter8644,2025-07-02 05:03:21,2025-07-02 10:34:10.005183
sysadmin,I mistakenly shared a PFX file generated by our enterprise production CA server,213,https://www.reddit.com/r/sysadmin/comments/1lp4e7d/i_mistakenly_shared_a_pfx_file_generated_by_our/,Yaseen743,2025-07-01 15:19:23,2025-07-02 10:34:10.005183
sysadmin,RingCentral Issues,3,https://www.reddit.com/r/sysadmin/comments/1lpvk45/ringcentral_issues/,Morcedant,2025-07-02 13:14:35,2025-07-02 10:34:10.005183
sysadmin,Microsoft 365 Tenant Configuration backup,3,https://www.reddit.com/r/sysadmin/comments/1lpvb6s/microsoft_365_tenant_configuration_backup/,SmoothRunnings,2025-07-02 13:03:35,2025-07-02 10:34:10.005183
sysadmin,HP EliteBook 840 G7 – Windows 11 Standby Issue: Devices Won’t Wake Up,5,https://www.reddit.com/r/sysadmin/comments/1lprasd/hp_elitebook_840_g7_windows_11_standby_issue/,La_Ragazza_Della,2025-07-02 09:23:05,2025-07-02 10:34:10.005183
sysadmin,"Docking Station ""Profile""?",3,https://www.reddit.com/r/sysadmin/comments/1lpu1jf/docking_station_profile/,baudwithcompter,2025-07-02 12:02:58,2025-07-02 10:34:10.005183
MadeMeSmile,A meow-ment she’ll never forget.,6372,https://v.redd.it/iyqfslf81gaf1,Afraid-Objective3049,2025-07-02 11:07:12,2025-07-02 10:34:10.005183
MadeMeSmile,Skilled pilot makes a smiley face in the sky,3277,https://v.redd.it/6vw4nfkwkgaf1,theseeenutzzz,2025-07-02 12:57:41,2025-07-02 10:34:10.005183
MadeMeSmile,A King’s Guard and his Mum,49873,https://i.redd.it/4iv4bkwjhdaf1.jpeg,FoI2dFocus,2025-07-02 02:33:13,2025-07-02 10:34:10.005183
MadeMeSmile,Thirsty crow,7335,https://v.redd.it/9sh6825k6eaf1,Douglasqqq,2025-07-02 04:53:46,2025-07-02 10:34:10.005183
MadeMeSmile,Driver apologises to motorcyclist from a previous encounter,10829,https://v.redd.it/lg6e0kqujdaf1,Hypnoidz,2025-07-02 02:46:18,2025-07-02 10:34:10.005183
MadeMeSmile,Even the cat is happy,2974,https://www.reddit.com/gallery/1lpq4sh,Key_Associate7476,2025-07-02 08:02:47,2025-07-02 10:34:10.005183
MadeMeSmile,"[OC] My brother (21, autistic & blind) texted me for the first time recently. He also said I love you for the first time ever.",9942,https://i.redd.it/g1futjracdaf1.jpeg,Vast_Ant_3355,2025-07-02 02:03:46,2025-07-02 10:34:10.005183
MadeMeSmile,This dog’s smile is brighter than my future! 🐶✨,773,https://v.redd.it/tr2a65hudgaf1,Neonklight,2025-07-02 12:42:57,2025-07-02 10:34:10.005183
MadeMeSmile,W dad,64500,https://i.redd.it/boqxbm8w8baf1.jpeg,TheGhost5322,2025-07-01 19:01:08,2025-07-02 10:34:10.005183
MadeMeSmile,His friends just made his birthday even more special,75067,https://v.redd.it/22kht1obhaaf1,LazyGuy4U,2025-07-01 16:27:42,2025-07-02 10:34:10.005183
MadeMeSmile,Ricky’s Smile Is Coming Back — And I Just Had to Share This Moment (OC),256,https://www.reddit.com/gallery/1lpvw1i,Traditional_March493,2025-07-02 13:29:11,2025-07-02 10:34:10.005183
MadeMeSmile,Well it made me smile so..,1612,https://v.redd.it/nfaj2584qdaf1,MogoBugu,2025-07-02 03:21:14,2025-07-02 10:34:10.005183
MadeMeSmile,Who's a good boy,31526,https://i.redd.it/nc1v7u5q6aaf1.jpeg,TheGhost5322,2025-07-01 15:27:12,2025-07-02 10:34:10.005183
MadeMeSmile,Y'all going to get caught every time lol,522,https://v.redd.it/pexxuwwuveaf1,n8saces,2025-07-02 07:15:12,2025-07-02 10:34:10.005183
MadeMeSmile,Proof that rock bottom isn't forever.,59208,https://i.redd.it/5srk9a52j9af1.png,DravidVanol,2025-07-01 13:14:35,2025-07-02 10:34:10.005183
MadeMeSmile,Sister helps her blind brother out on an Easter egg hunt.,2023,https://v.redd.it/8fb76pozlcaf1,Sebastianlim,2025-07-01 23:36:20,2025-07-02 10:34:10.005183
MadeMeSmile,Incredible Dad Making a Difference,43421,https://www.reddit.com/gallery/1lp123s,EmergencyRead5254,2025-07-01 13:00:56,2025-07-02 10:34:10.005183
MadeMeSmile,Faith the ASL Dog,7723,https://v.redd.it/19p5al8mfaaf1,Sarang_616,2025-07-01 16:17:03,2025-07-02 10:34:10.005183
MadeMeSmile,Bro is middle aged and newborn at the same time,6274,https://v.redd.it/rjbotxzs3aaf1,rgatoNacho,2025-07-01 15:10:51,2025-07-02 10:34:10.005183
MadeMeSmile,Security guard playing flute in his idle time,173,https://i.redd.it/8oscfbh6pfaf1.jpeg,AnIgnorablePerson,2025-07-02 09:59:33,2025-07-02 10:34:10.005183
CombatFootage,A Reminder & a warning,100,/r/CombatFootage/comments/1744hyt/important_message_regarding_combat_footage/,knowyourpast,2025-06-25 22:34:12,2025-07-02 10:34:10.005183
CombatFootage,Ukraine Discussion/Question Thread - 02/05/2025+,262,https://www.reddit.com/r/CombatFootage/comments/1ihuwe5/ukraine_discussionquestion_thread_02052025/,knowyourpast,2025-02-04 22:45:58,2025-07-02 10:34:10.005183
CombatFootage,Ukrainian drone drop on a Russian soldier who instantly takes his own life afterwards. June 2025,470,https://v.redd.it/ibu328obmgaf1,jisooya1432,2025-07-02 13:05:45,2025-07-02 10:34:10.005183
CombatFootage,"Russian Soldier climbs into a container and gets taken out by Ukrainian Drone, Pokrovsk",370,https://v.redd.it/yn1e1qcgogaf1,Zerotwo_0,2025-07-02 13:17:31,2025-07-02 10:34:10.005183
CombatFootage,1st Special Operations Detachment “UA_REG” Destroy large number of Russian and their Equipment Sumy Direction,137,https://v.redd.it/49iq0nsfpgaf1,Zerotwo_0,2025-07-02 13:23:22,2025-07-02 10:34:10.005183
CombatFootage,Ukrainian Special forces Eliminate 4 Russians and Capture 1 in Sumy region,108,https://v.redd.it/g4egr4ncngaf1,Zerotwo_0,2025-07-02 13:11:12,2025-07-02 10:34:10.005183
CombatFootage,"S-5 Rocket attack on a US Humvee. Baghdad, Iraq 2006~2007.",172,https://v.redd.it/upgs8zym5faf1,Strict_Key3318,2025-07-02 08:11:54,2025-07-02 10:34:10.005183
CombatFootage,An American tomahawk cruise recorded flying over Baghdad during the second gulf war February 2nd 1991,1642,https://v.redd.it/tivc473efbaf1,Abksisos,2025-07-01 19:37:36,2025-07-02 10:34:10.005183
CombatFootage,"Ukrainian drone drops grenade on russian motorbikers, leading to a sequential detonation of several AP mines",5607,https://v.redd.it/6ln84cxyi9af1,Comprehensive_Box683,2025-07-01 13:14:04,2025-07-02 10:34:10.005183
CombatFootage,"Drone POV of the Russian atv driver getting hit in Sumy Published by ""Magyar""",2397,https://v.redd.it/qf25youmjaaf1,ProTupper,2025-07-01 16:40:03,2025-07-02 10:34:10.005183
CombatFootage,"Tadtad cultists, a Christian ethno-nationalist organization in the Philippines, commits to a bolo/machete charge against the CAFGU, Citizen Armed Forces Geographical Unit, after the CAFGU unit tried to arrest cult leader Alfredo Opciona when negotiations for his surrender broke down -Aug. 2000-",69,https://www.youtube.com/watch?v=adSP0SFBd_A,Soopah_Fly,2025-07-02 11:58:38,2025-07-02 10:34:10.005183
CombatFootage,"For decades, this T-62M probably stood as a museum exhibit. The Russians sent it to Ukraine and camouflaged it in the forest. It was destroyed by the 14th Mechanized Brigade, Kupʼyansk direction",508,https://v.redd.it/orkj1j2ejcaf1,SmokingBlackSeaFleet,2025-07-01 23:23:56,2025-07-02 10:34:10.005183
CombatFootage,Drone footage of a Ukrainian Mig-29 attacking a fortified Russian underground position in Southern Ukraine with GBU39 bombs.,32,https://v.redd.it/u75f193sygaf1,MilesLongthe3rd,2025-07-02 14:15:14,2025-07-02 10:34:10.005183
CombatFootage,"Drone operators of the 77th Airmobile of Ukraine eliminate Russian infantry and vehicles, Kupʼyansk direction",464,https://v.redd.it/k7w4ri6vlcaf1,SmokingBlackSeaFleet,2025-07-01 23:36:08,2025-07-02 10:34:10.005183
CombatFootage,Chechens part of the Ukrainian HUR ambush a Russian motorized unit and confiscates their motorcycles while doing a donut.,120,https://www.youtube.com/watch?v=j9lzPBX1Aqg,Aedlo,2025-07-02 05:33:08,2025-07-02 10:34:10.005183
CombatFootage,"US Bradley gets blown up by an IED - Taji, Iraq 2006~2007",2996,https://v.redd.it/ie4mi0zrs8af1,Strict_Key3318,2025-07-01 10:48:41,2025-07-02 10:34:10.005183
CombatFootage,Precise strikes by the artillery of the Ukrainian 28th Mechanized Brigade took out Russian infantry and UAV operators. Toretsk direction. June 2025 [Published 01.07.2025],424,https://v.redd.it/pfmiwv6gsbaf1,GermanDronePilot,2025-07-01 20:50:50,2025-07-02 10:34:10.005183
CombatFootage,Compilation of launches by various Israeli missile-defense systems during the Iran–Israel war,538,https://v.redd.it/53f8njjpuaaf1,RoyU16,2025-07-01 17:42:22,2025-07-02 10:34:10.005183
CombatFootage,"Exo-Atmospheric interception of Houthi Ballisitic missile over Israeli territory, July 1 2025",423,https://v.redd.it/7rc8f6e8waaf1,NamelessForce,2025-07-01 17:52:37,2025-07-02 10:34:10.005183
CombatFootage,"[Myanmar/Burma] Rebels from the Unicorn Guerrilla Force and No More Dictatorship groups raid the Nagapatkyaung junta camp in Mingin Township  (June 27, 2025)",11,https://v.redd.it/wsmxzwiwcgaf1,CaliRecluse,2025-07-02 12:15:59,2025-07-02 10:34:10.005183
relationship_advice,Think of the comments as inverted Uber ratings. (click to find out what this means),286,https://www.reddit.com/r/relationship_advice/comments/1dc8ke8/think_of_the_comments_as_inverted_uber_ratings/,eganist,2024-06-10 00:24:36,2025-07-02 10:34:10.005183
relationship_advice,I (F27) am starting to regret my age gap marriage with (M43),1364,https://www.reddit.com/r/relationship_advice/comments/1lpmkd2/i_f27_am_starting_to_regret_my_age_gap_marriage/,ThrowRA383748383,2025-07-02 04:18:13,2025-07-02 10:34:10.005183
relationship_advice,"My boyfriend (23m) girl BFF (24f) is a content creator. I (25f) don’t want him seeing her ever again after I learned the truth , but his family says I am tripping?",559,https://www.reddit.com/r/relationship_advice/comments/1lpppr3/my_boyfriend_23m_girl_bff_24f_is_a_content/,ThrowRaViolentt,2025-07-02 07:33:37,2025-07-02 10:34:10.005183
relationship_advice,My (M32) gf (F28) is a Trump supporter and it's affecting our relationship. Is politics something to break up over?,189,https://www.reddit.com/r/relationship_advice/comments/1lptecy/my_m32_gf_f28_is_a_trump_supporter_and_its/,throwra_lonelybf,2025-07-02 11:29:38,2025-07-02 10:34:10.005183
relationship_advice,"My sister (26F) scheduled her baby shower during my vacation, wants my husband (38M) and I (31F) to cancel our vacation, and wants my husband to cater the 50+ person event for free. How do I back out with as little damage as possible?",2569,https://www.reddit.com/r/relationship_advice/comments/1lpddqo/my_sister_26f_scheduled_her_baby_shower_during_my/,ThrowRACurious_Idea,2025-07-01 21:02:47,2025-07-02 10:34:10.005183
relationship_advice,"My(25M) Wife(24F) likes to dress up as Disney Princesses during sex and act like them. I cannot stand it. How can I stop it, but also support her (if I can)?",243,https://www.reddit.com/r/relationship_advice/comments/1lpqkep/my25m_wife24f_likes_to_dress_up_as_disney/,ThrowRA_CuppedAnt43,2025-07-02 08:33:25,2025-07-02 10:34:10.005183
relationship_advice,Wife is addicted to Erotica (47M) (48F),210,https://www.reddit.com/r/relationship_advice/comments/1lpm1or/wife_is_addicted_to_erotica_47m_48f/,HorrorOk1020,2025-07-02 03:50:16,2025-07-02 10:34:10.005183
relationship_advice,My (20F) boyfriend (22M) wants me to dress like a middle aged woman,766,https://www.reddit.com/r/relationship_advice/comments/1lpb00p/my_20f_boyfriend_22m_wants_me_to_dress_like_a/,ImportantNobody1654,2025-07-01 19:29:58,2025-07-02 10:34:10.005183
relationship_advice,Husband 25M asks me 23F for sex every day,28,https://www.reddit.com/r/relationship_advice/comments/1lpu9jf/husband_25m_asks_me_23f_for_sex_every_day/,ThrowRAFisher1,2025-07-02 12:14:06,2025-07-02 10:34:10.005183
relationship_advice,I (18M) can't seem to finish during sex with my girlfriend (18F),151,https://www.reddit.com/r/relationship_advice/comments/1lpkdm2/i_18m_cant_seem_to_finish_during_sex_with_my/,Classic-Visual-9556,2025-07-02 02:22:35,2025-07-02 10:34:10.005183
relationship_advice,I 29 F found that my husband 38 M in on tinder.,16,https://www.reddit.com/r/relationship_advice/comments/1lpx0o6/i_29_f_found_that_my_husband_38_m_in_on_tinder/,Tough_Ad1763,2025-07-02 14:16:58,2025-07-02 10:34:10.005183
relationship_advice,My boyfriend (28m) said his therapist thinks I (26f) might have BPD,315,https://www.reddit.com/r/relationship_advice/comments/1lpergc/my_boyfriend_28m_said_his_therapist_thinks_i_26f/,tea_wit_da_ice,2025-07-01 21:59:00,2025-07-02 10:34:10.005183
relationship_advice,I (38F) love my boyfriend (40M) but he's got some quirks that are starting to wear on me and I need advice,16,https://www.reddit.com/r/relationship_advice/comments/1lpvaro/i_38f_love_my_boyfriend_40m_but_hes_got_some/,D1senchantedUnicorn,2025-07-02 13:03:06,2025-07-02 10:34:10.005183
relationship_advice,"My (27F) boyfriend (31M) is silly and awkward in bed, and it’s a huge turn off",127,https://www.reddit.com/r/relationship_advice/comments/1lpiqrl/my_27f_boyfriend_31m_is_silly_and_awkward_in_bed/,222energy,2025-07-02 01:01:09,2025-07-02 10:34:10.005183
relationship_advice,My (22M) girlfriend (21F) insulted my deceased Ex-girlfriend and now im having major doubts about the relationship…,241,https://www.reddit.com/r/relationship_advice/comments/1lpc86u/my_22m_girlfriend_21f_insulted_my_deceased/,Lumpy-Effective-5680,2025-07-01 20:17:44,2025-07-02 10:34:10.005183
relationship_advice,I'm(37 f) worried my husband(35 m) is grieving alone and don't know what to do,18,https://www.reddit.com/r/relationship_advice/comments/1lpqtz5/im37_f_worried_my_husband35_m_is_grieving_alone/,EmployerSerious3757,2025-07-02 08:51:38,2025-07-02 10:34:10.005183
relationship_advice,She (24F) broke up with me (23m) after 3 years and f**ked my college teammate a week later. ever since I found out has been trying to get me back,997,https://www.reddit.com/r/relationship_advice/comments/1loyxux/she_24f_broke_up_with_me_23m_after_3_years_and/,Sorry_Season_1695,2025-07-01 11:14:30,2025-07-02 10:34:10.005183
relationship_advice,I [31F] am about to go through a breakup with my partner [33M] of 11 years,6,https://www.reddit.com/r/relationship_advice/comments/1lpwqf3/i_31f_am_about_to_go_through_a_breakup_with_my/,kits4life,2025-07-02 14:05:09,2025-07-02 10:34:10.005183
relationship_advice,"My Baby's father(35M) ended up turning his phone off, after I(29F) asked him to get a humidifier, saline spray for our daughter who's sick with a respiratory virus. Need advice",232,https://www.reddit.com/r/relationship_advice/comments/1lp7zg3/my_babys_father35m_ended_up_turning_his_phone_off/,Swimming_Listen8838,2025-07-01 17:35:00,2025-07-02 10:34:10.005183
relationship_advice,34F found out boyfriend was cheating 33M 8 months together. He is now the 5th man to have cheated on me. Where am I choosing badly?,44,https://www.reddit.com/r/relationship_advice/comments/1lpk26e/34f_found_out_boyfriend_was_cheating_33m_8_months/,sammielf,2025-07-02 02:06:38,2025-07-02 10:34:10.005183
discordapp,"Nitro Scams, Malicious Content, & Account Support",1177,https://www.reddit.com/r/discordapp/comments/tkgivh/nitro_scams_malicious_content_account_support/,Pruvided,2022-03-22 23:41:24,2025-07-02 10:34:10.005183
discordapp,Bug Megathread vol 9: June + July,36,https://www.reddit.com/r/discordapp/comments/1l2igpl/bug_megathread_vol_9_june_july/,WumpusWhisperer,2025-06-03 17:48:12,2025-07-02 10:34:10.005183
discordapp,my mother keeps logging into my discord despite everything i do. how?,2640,https://i.redd.it/w2j4sahy6caf1.png,toomuchwaterhelp,2025-07-01 22:17:00,2025-07-02 10:34:10.005183
discordapp,Does Discord even know what we want ignore/block to do? Cause this ain't it.,220,https://i.redd.it/f7y0ye5egfaf1.png,CannotThonk96,2025-07-02 09:21:10,2025-07-02 10:34:10.005183
discordapp,Why cant i use some emojis and stickers,24,https://i.redd.it/dk0pxy9zefaf1.jpeg,Fancy-Emergency-8822,2025-07-02 09:02:22,2025-07-02 10:34:10.005183
discordapp,Discord has just redesigned their Support page.,82,https://i.redd.it/5lqkpc9k8baf1.png,HelloitsWojan,2025-07-01 18:59:23,2025-07-02 10:34:10.005183
discordapp,"Hi Discord, I got the shirt! And more!!",331,https://www.reddit.com/gallery/1lowr8f,SaoriTakebe,2025-07-01 08:57:33,2025-07-02 10:34:10.005183
discordapp,"GIFs take too much space, please add a setting to scale them by 50% or 75%. Also, disabling tenor gifs do not disable sent gifs, and clicking sent gifs should display them inside discord, not open a browser (desktop)",1,https://i.redd.it/z510t5ng6gaf1.jpeg,all_is_love6667,2025-07-02 11:38:47,2025-07-02 10:34:10.005183
discordapp,Orange app icon on Android?,7,https://www.reddit.com/r/discordapp/comments/1lpnsje/orange_app_icon_on_android/,pacanukeha,2025-07-02 05:30:04,2025-07-02 10:34:10.005183
discordapp,So... can we get gift cards or something?,0,https://i.redd.it/8yxqiry6ygaf1.png,TheYoungAnimatorFR,2025-07-02 14:12:23,2025-07-02 10:34:10.005183
discordapp,Does anyone know why my app icon has suddenly changed to this weird gold colour?,1,https://i.imgur.com/Evc0wWC.png,ShesASquid,2025-07-02 14:07:20,2025-07-02 10:34:10.005183
discordapp,Is there an app that notifies users of Instagram lives?,0,https://www.reddit.com/r/discordapp/comments/1lpwg50/is_there_an_app_that_notifies_users_of_instagram/,aluhdore,2025-07-02 13:53:20,2025-07-02 10:34:10.005183
discordapp,How to add tag to post?,0,https://i.redd.it/u3a6husbsgaf1.jpeg,Senior_University921,2025-07-02 13:38:58,2025-07-02 10:34:10.005183
discordapp,Since when did Discord do this on mobile?,4,https://i.redd.it/fzd3qrsefeaf1.jpeg,Rosafee_,2025-07-02 05:43:01,2025-07-02 10:34:10.005183
discordapp,Discord hiding photos?,5,https://www.reddit.com/gallery/1lpm328,Ok-Plan1423,2025-07-02 03:52:18,2025-07-02 10:34:10.005183
discordapp,Notification sounds flipping audio left right channels,1,https://www.reddit.com/r/discordapp/comments/1lpung5/notification_sounds_flipping_audio_left_right/,GooseKennedy,2025-07-02 12:33:06,2025-07-02 10:34:10.005183
discordapp,App not loading?,1,https://i.redd.it/keddhabebgaf1.jpeg,HalloweenJack7,2025-07-02 12:04:04,2025-07-02 10:34:10.005183
discordapp,Voice note is resetting/can't listen to it,1,https://www.reddit.com/r/discordapp/comments/1lptwwz/voice_note_is_resettingcant_listen_to_it/,Yussi029,2025-07-02 11:56:37,2025-07-02 10:34:10.005183
discordapp,What happened to gartic phone and how do I fix it,3,https://www.reddit.com/gallery/1lpnw0x,Mango_Tango_eats_ppl,2025-07-02 05:35:59,2025-07-02 10:34:10.005183
discordapp,Opening new discord overlay makes me tab out of the game,1,https://www.reddit.com/r/discordapp/comments/1lps6m4/opening_new_discord_overlay_makes_me_tab_out_of/,manu_the_modder,2025-07-02 10:19:09,2025-07-02 10:34:10.005183
pcgaming,"Tech Support and Basic Questions Thread - July 01, 2025",2,https://www.reddit.com/r/pcgaming/comments/1lot6dy/tech_support_and_basic_questions_thread_july_01/,AutoModerator,2025-07-01 05:01:42,2025-07-02 10:34:10.005183
pcgaming,"What Are You Playing Thread - June 30, 2025",6,https://www.reddit.com/r/pcgaming/comments/1lny24m/what_are_you_playing_thread_june_30_2025/,AutoModerator,2025-06-30 04:02:17,2025-07-02 10:34:10.005183
pcgaming,"Capcom sees 61% surge in revenue from Steam, PlayStation revenue decreases",289,https://automaton-media.com/en/news/capcom-sees-61-surge-in-revenue-from-steam-playstation-revenue-decreases/,Suspicious_Two786,2025-07-02 11:50:01,2025-07-02 10:34:10.005183
pcgaming,"Obsidian director Josh Sawyer says it's a 'mistake' for RPGs to sacrifice crunchy 'sweaty boy' systems in favour of a 'one size fits all' game, since easier difficulties aren't too hard to make",1310,https://www.pcgamer.com/gaming-industry/game-development/obsidian-director-josh-sawyer-says-its-a-mistake-for-rpgs-to-sacrifice-crunchy-sweaty-boy-systems-in-favour-of-a-one-size-fits-all-game-since-easier-difficulties-arent-too-hard-to-make/,lurkingdanger22,2025-07-02 00:44:56,2025-07-02 10:34:10.005183
pcgaming,The 'Online Games will have to balanced around Eventually being forced to be offline Single Player' Argument,135,https://www.reddit.com/r/pcgaming/comments/1lptujv/the_online_games_will_have_to_balanced_around/,Caldraddigon,2025-07-02 11:53:14,2025-07-02 10:34:10.005183
pcgaming,"PC Gamer did an interview with the solo developer of Erenshor, the simulated MMO built for singleplayer",242,https://www.pcgamer.com/games/rpg/erenshor-is-a-simulated-mmo-built-for-singleplayer-by-a-single-person/,StillNotHans,2025-07-02 07:06:18,2025-07-02 10:34:10.005183
pcgaming,PSA - The email address I used for Nexus account is now used to brute-force access to my mail server.,1001,https://www.reddit.com/r/pcgaming/comments/1lpcoxe/psa_the_email_address_i_used_for_nexus_account_is/,NoMoreCitrix,2025-07-01 20:35:49,2025-07-02 10:34:10.005183
pcgaming,POSTAL 2 Redux on Steam,45,https://store.steampowered.com/app/3839180/POSTAL_2_Redux/,abracadaver82,2025-07-02 13:22:08,2025-07-02 10:34:10.005183
pcgaming,"I'm not sure if indie devs, are allowed to share their success stories here, but just wanted to share, that after a very rocky start and a lot of of sleepless weeks, my game's recent reviews have been all positive",164,https://i.redd.it/tdmrfpmceeaf1.png,Captain0010,2025-07-02 05:37:48,2025-07-02 10:34:10.005183
pcgaming,"Dave the Diver director addresses controversial “Best Indie Game” nomination from 2023. “There’s nothing indie about us, we didn’t apply for it”",215,https://automaton-media.com/en/news/dave-the-diver-director-addresses-controversial-best-indie-game-nomination-from-2023-theres-nothing-indie-about-us-we-didnt-apply-for-it/,Turbostrider27,2025-07-02 03:30:56,2025-07-02 10:34:10.005183
pcgaming,"Nexus mods will introduce age verification in the near future, for UK and EU users, regarding adult content",2236,https://www.nexusmods.com/news/15319,Just_a_user_name_,2025-07-01 14:48:03,2025-07-02 10:34:10.005183
pcgaming,Microsoft Begins Deep Job Cuts Across Xbox Division,30,https://www.bloomberg.com/news/articles/2025-07-02/microsoft-begins-deep-job-cuts-across-xbox-division?accessToken=eyJhbGciOiJIUzI1NiIsInR5cCI6IkpXVCJ9.eyJzb3VyY2UiOiJTdWJzY3JpYmVyR2lmdGVkQXJ0aWNsZSIsImlhdCI6MTc1MTQ2MDUyOSwiZXhwIjoxNzUyMDY1MzI5LCJhcnRpY2xlSWQiOiJTWVJWTDFEV1JHRzAwMCIsImJjb25uZWN0SWQiOiJCMUVBQkI5NjQ2QUM0REZFQTJBRkI4MjI1MzgyQTJFQSJ9.HYeStbJNn6_ntf1rQ17kOC1dHHlVk_Zx4yCTGqcYXAA&leadSource=uverify%20wall,Turbostrider27,2025-07-02 12:49:56,2025-07-02 10:34:10.005183
pcgaming,"The Radeon RX 9070 XT is Now Faster, AMD FineWine",28,https://youtube.com/watch?v=aWfMibZ8t00,mockingbird-,2025-07-02 13:18:13,2025-07-02 10:34:10.005183
pcgaming,Honest question: I see SteamOS being constantly praised. Is it viable for Valve to release SteamOS to normal gaming PCs?,246,https://www.reddit.com/r/pcgaming/comments/1lpcyal/honest_question_i_see_steamos_being_constantly/,industrysaurus,2025-07-01 20:46:07,2025-07-02 10:34:10.005183
pcgaming,Sources: Everwild has been cancelled as Xbox layoffs hit Rare,9,https://www.videogameschronicle.com/news/sources-everwild-has-been-cancelled-as-xbox-layoffs-hit-rare/,Turbostrider27,2025-07-02 14:00:52,2025-07-02 10:34:10.005183
pcgaming,"How Warhammer 40,000: Darktide won players back after a lukewarm first year",292,https://www.gamesindustry.biz/how-warhammer-40000-darktide-won-players-back-after-a-lukewarm-first-year,Turbostrider27,2025-07-01 16:53:43,2025-07-02 10:34:10.005183
pcgaming,"Stephen Totilo: ""Krafton says the 3 leaders of Unknown Worlds (Subnautica 2) are out, replaced by Steve Papoutsis, who already runs their studio Striking Distance. Ted Gill, Charlie Cleveland and Max McGuire had some 50 years of combined tenure at Unknown Worlds""",90,https://bsky.app/profile/stephentotilo.bsky.social/post/3lswq7lxho22p,lurkingdanger22,2025-07-01 23:02:00,2025-07-02 10:34:10.005183
pcgaming,Humble Choice July 2025 Games Revealed,168,https://www.humblebundle.com/membership/july_2025,Turbostrider27,2025-07-01 17:00:14,2025-07-02 10:34:10.005183
pcgaming,Ampersat free to keep on Steam,103,https://store.steampowered.com/app/1356040/Ampersat/,lurkingdanger22,2025-07-01 17:05:32,2025-07-02 10:34:10.005183
pcgaming,"Coming to Game Pass: Tony Hawk's Pro Skater 3 + 4, Minami Lane, Ultimate Chicken Horse, and More",41,https://news.xbox.com/en-us/2025/07/01/xbox-game-pass-july-2025-wave-1/,Aleksanterinleivos,2025-07-01 21:09:18,2025-07-02 10:34:10.005183
Games,"Weekly /r/Games Discussion - What have you been playing, and what are your thoughts? - June 29, 2025",18,https://www.reddit.com/r/Games/comments/1lna5w1/weekly_rgames_discussion_what_have_you_been/,AutoModerator,2025-06-29 09:01:03,2025-07-02 10:34:10.005183
