subreddit,title,score,url,author,created_utc,extracted_at
soccer,"Borussia Mönchengladbach suspends Florian Neuhaus to the u23 for 4 weeks and gives him a hefty fine after calling sporting director Roland Virkus ""the worst manager in the world""",181,https://www.borussia.de/news/borussia-spricht-strafe-fuer-florian-neuhaus-aus?fbclid=PAQ0xDSwLSBWxleHRuA2FlbQIxMQABp3dd0ETAFXkOvTjvXtwEJfU75kURmxM8j0nnY5h52AzKMmXgZLcJ_YwOS4bU_aem_2B-m0a8hO0sLbb5n48huzg,TheSteveGarden,2025-07-02 12:30:42,2025-07-02 10:34:10.005183
soccer,[Croatian Source] Ivan Rakitić had ended his career. He will stay at Hajduk Split and become the assistant sports director.,544,https://www.tportal.hr/sport/clanak/ivan-rakitic-zavrsio-je-karijeru-ali-ostaje-u-hajduku-20250701,slopxgate,2025-07-02 05:52:55,2025-07-02 10:34:10.005183
soccer,"Romelu Lukaku: “After the 2023 UCL final with Inter, I went back to Chelsea, I said I wanted a chance again with the first team, Chelsea sent me to reserves. And what comes out to the media? ‘Lukaku wants to leave’, no, I didn’t want to leave""",805,https://v.redd.it/mbpsfyqsmdaf1,landofphi,2025-07-02 03:03:02,2025-07-02 10:34:10.005183
soccer,Alternative angles of Bono save vs Manchester City,8362,https://v.redd.it/83v3pbgqu9af1,WeTalkBoxing,2025-07-01 14:20:05,2025-07-02 10:34:10.005183
soccer,"[Fabrizio Romano] Jonathan David to Juventus, here we go! Verbal agreement reached overnight on every detail with Canadian striker. Long term deal agreed and Jonathan David’s set to travel for medical tests, formal steps to follow. Contracts to be checked and signed soon.",439,https://www.threads.com/@fabriziorom/post/DLl_yaqIem4?xmt=AQF01wHzMoyeqKJU2KOT2DYAE_XIovCTnKmlRSop0088_w,lacrimosa049,2025-07-02 05:30:57,2025-07-02 10:34:10.005183
soccer,Jarell Quansah completes transfer to Bayer Leverkusen,208,https://www.liverpoolfc.com/news/jarell-quansah-completes-transfer-bayer-leverkusen,YadMot,2025-07-02 09:03:45,2025-07-02 10:34:10.005183
soccer,Ramos big chance against Dortmund  90+1',621,https://streamain.com/en/8bIOvEyOgdkoGxV/watch,ArtisticLayer5,2025-07-02 02:54:29,2025-07-02 10:34:10.005183
Eldenring,Daily Roundtable: Community Q&A,6,https://www.reddit.com/r/Eldenring/comments/1lddmd5/daily_roundtable_community_qa/,AutoModerator,2025-06-17 04:01:02,2025-07-02 10:34:10.005183
Eldenring,"Nightreign Launch MEGATHREAD! Community Password, Tips, Subreddit Guidelines",148,https://www.reddit.com/r/Eldenring/comments/1kyrhp5/nightreign_launch_megathread_community_password/,jack0641,2025-05-30 01:06:36,2025-07-02 10:34:10.005183
Eldenring,where is the nightlord (art by me),2373,https://www.reddit.com/gallery/1lpqb7g,ProfessorGemini,2025-07-02 08:15:25,2025-07-02 10:34:10.005183
Eldenring,How do you plan to survive if you had to as a normal human?,2290,https://i.redd.it/pyl3hkusmeaf1.png,ProgrammerJunior9632,2025-07-02 06:25:40,2025-07-02 10:34:10.005183
Eldenring,Behold! Our ultimate wisdom!(art by me),1725,https://i.redd.it/3dl0u3pdrdaf1.jpeg,Groomgrim,2025-07-02 03:28:20,2025-07-02 10:34:10.005183
Eldenring,I just received both Elden Ring and Elden Ring Nightreign for my birthday,503,https://i.redd.it/is06wxwy6faf1.png,Damaj301damaj,2025-07-02 08:17:29,2025-07-02 10:34:10.005183
Eldenring,Found fingers while road triplin’,151,https://i.redd.it/tq82qx3rtgaf1.jpeg,SweetAcanthisitta616,2025-07-02 13:46:58,2025-07-02 10:34:10.005183
Eldenring,World design firing on all cylinders,1880,https://i.redd.it/ijcowrhwlcaf1.jpeg,Smells_like_Children,2025-07-01 23:35:53,2025-07-02 10:34:10.005183
Eldenring,Chill out that sord only yours,9599,https://i.redd.it/stnjjuanbaaf1.jpeg,Girlxgirllover2k4,2025-07-01 15:54:50,2025-07-02 10:34:10.005183
Eldenring,What’s your favorite weapon in the DLC ?,2527,https://i.redd.it/7g8o437jxbaf1.jpeg,AkUma_ljk,2025-07-01 21:19:14,2025-07-02 10:34:10.005183
Eldenring,It worked for Vyke. Why not me?,3540,https://i.redd.it/s0eg94x6gbaf1.jpeg,Grandmaster_Invoker,2025-07-01 19:42:02,2025-07-02 10:34:10.005183
Eldenring,"In elden ring, why does the godskin duo have so many appearances? Why dont they ever truly die?",173,https://i.redd.it/u0xlko3krfaf1.jpeg,oyemofongoo,2025-07-02 10:12:52,2025-07-02 10:34:10.005183
Eldenring,Why the hell first boss was so hard,2973,https://i.redd.it/xpp768d93baf1.png,Direct_Welcome7100,2025-07-01 18:35:55,2025-07-02 10:34:10.005183
Eldenring,I’m not good at Souls games… because this is my first one. Took me 14 hours to beat Radahn. I can finally uninstall trauma,723,https://v.redd.it/gxlhrpgh5daf1,Wild-Push-2207,2025-07-02 01:26:38,2025-07-02 10:34:10.005183
Eldenring,Am I the only one who thinks Rya has a solid snake design?,11104,https://i.redd.it/37yuakee79af1.jpeg,French-Caller,2025-07-01 12:09:11,2025-07-02 10:34:10.005183
Eldenring,Almost time to get bodied by the power couple,55,https://i.redd.it/v2636lhczgaf1.png,NashquttinLittleWolf,2025-07-02 14:18:18,2025-07-02 10:34:10.005183
Eldenring,Queen Marika the Eternal - Art by me,430,https://i.redd.it/jnapf8d1ldaf1.jpeg,Halberick,2025-07-02 02:52:49,2025-07-02 10:34:10.005183
Eldenring,Is it weird for me to say that this was my favorite boss in the DLC?,183,https://i.redd.it/tf4qyd00ueaf1.png,ColtonfrayHSC,2025-07-02 07:07:21,2025-07-02 10:34:10.005183
Eldenring,Fights you never look forward to on replays?,920,https://i.redd.it/pgov6crivbaf1.jpeg,W3SS3LVM,2025-07-01 21:09:10,2025-07-02 10:34:10.005183
Eldenring,Wakizashi adds fun and flexibility to a basic katana setup,197,https://i.redd.it/rnr7ma92aeaf1.png,NameCheeksOut,2025-07-02 05:13:47,2025-07-02 10:34:10.005183
badroommates,I think my roommate wants to kill me,62,https://www.reddit.com/r/badroommates/comments/1lpnxxy/i_think_my_roommate_wants_to_kill_me/,Own_Motor4032,2025-07-02 05:39:15,2025-07-02 10:34:10.005183
badroommates,I finally moved out! Here’s an update from my previous post: I didn’t get my necklace!,5,https://www.reddit.com/gallery/1lpwyos,Solid_Minimum2065,2025-07-02 14:14:46,2025-07-02 10:34:10.005183
badroommates,Why can't my roommate just mind her fucking business,141,https://www.reddit.com/r/badroommates/comments/1lpbegp/why_cant_my_roommate_just_mind_her_fucking/,LoverOfGayContent,2025-07-01 19:45:27,2025-07-02 10:34:10.005183
badroommates,"Tenant my boyfriend is replacing won’t move out, what can be done?",47,https://www.reddit.com/r/badroommates/comments/1lpj6gs/tenant_my_boyfriend_is_replacing_wont_move_out/,romeojuliettango47,2025-07-02 01:22:41,2025-07-02 10:34:10.005183
badroommates,roomate screamed the house was gonna flood because we replaced the shower,51,https://www.reddit.com/r/badroommates/comments/1lpay0p/roomate_screamed_the_house_was_gonna_flood/,hyuvii,2025-07-01 19:27:46,2025-07-02 10:34:10.005183
badroommates,Do all humans just lack any sort of decency now?,14,https://www.reddit.com/r/badroommates/comments/1lphnyn/do_all_humans_just_lack_any_sort_of_decency_now/,RandomQuestions979,2025-07-02 00:08:21,2025-07-02 10:34:10.005183
badroommates,Roommate acting out because I called him out for a few things and now its blown out of proportion.,5,https://www.reddit.com/r/badroommates/comments/1lpk4j1/roommate_acting_out_because_i_called_him_out_for/,LilAnxy,2025-07-02 02:10:04,2025-07-02 10:34:10.005183
badroommates,I've never had a single good roommate,5,https://www.reddit.com/r/badroommates/comments/1lpj9kf/ive_never_had_a_single_good_roommate/,porqueuno,2025-07-02 01:26:59,2025-07-02 10:34:10.005183
badroommates,Roommate doesn’t feed her cat,27,https://www.reddit.com/r/badroommates/comments/1lp2sna/roommate_doesnt_feed_her_cat/,thatcapricorn12,2025-07-01 14:15:26,2025-07-02 10:34:10.005183
badroommates,"My 54 y/o roommate (and landlord) won’t respect my space, and I feel trapped in my own home",32,https://www.reddit.com/r/badroommates/comments/1lozle8/my_54_yo_roommate_and_landlord_wont_respect_my/,Any-Reputation-295,2025-07-01 11:50:05,2025-07-02 10:34:10.005183
badroommates,Update about roommate accusing me of stealing her AirPods,194,https://www.reddit.com/r/badroommates/comments/1loocne/update_about_roommate_accusing_me_of_stealing_her/,cupidswing,2025-07-01 00:48:44,2025-07-02 10:34:10.005183
badroommates,How do you get your roommates to flush properly?,2,https://www.reddit.com/r/badroommates/comments/1lpieyt/how_do_you_get_your_roommates_to_flush_properly/,CandidCamel8209,2025-07-02 00:45:06,2025-07-02 10:34:10.005183
badroommates,Does your partner put partly eaten croissants back in the container or are they normal?,475,https://i.redd.it/8txrwi9n04af1.jpeg,bitofagrump,2025-06-30 18:42:27,2025-07-02 10:34:10.005183
badroommates,My roommate asked for more than her share of security deposit,55,https://www.reddit.com/r/badroommates/comments/1lotw3w/my_roommate_asked_for_more_than_her_share_of/,chantillycakke,2025-07-01 05:45:44,2025-07-02 10:34:10.005183
badroommates,I finally got my bad room mate out.,4,https://www.reddit.com/r/badroommates/comments/1lpbpzn/i_finally_got_my_bad_room_mate_out/,Jamster_1988,2025-07-01 19:58:17,2025-07-02 10:34:10.005183
badroommates,Another messy roommate story,1,https://www.reddit.com/r/badroommates/comments/1lpkrxv/another_messy_roommate_story/,crazypuglets,2025-07-02 02:43:19,2025-07-02 10:34:10.005183
badroommates,They broke the lease and ghosted because I asked them to scoop their cats shit.,83,https://www.reddit.com/r/badroommates/comments/1loqagg/they_broke_the_lease_and_ghosted_because_i_asked/,CuteFace1811,2025-07-01 02:25:00,2025-07-02 10:34:10.005183
badroommates,What’s the ethical protocol for kicking out a roommate?,2,https://www.reddit.com/r/badroommates/comments/1lpe7nx/whats_the_ethical_protocol_for_kicking_out_a/,No-Metal6495,2025-07-01 21:36:32,2025-07-02 10:34:10.005183
badroommates,introverted with roommates,2,https://www.reddit.com/r/badroommates/comments/1lpe6om/introverted_with_roommates/,SunNew1798,2025-07-01 21:35:28,2025-07-02 10:34:10.005183
badroommates,my roommate doesn’t properly care for their cat and almost never cleans up,3,https://www.reddit.com/r/badroommates/comments/1lp9r9v/my_roommate_doesnt_properly_care_for_their_cat/,No-Ad-1944,2025-07-01 18:42:17,2025-07-02 10:34:10.005183
personalfinance,"30-Day Challenge #7: Find and participate in a FREE activity in your area! (July, 2025)",3,https://www.reddit.com/r/personalfinance/comments/1lp11a2/30day_challenge_7_find_and_participate_in_a_free/,IndexBot,2025-07-01 13:00:03,2025-07-02 10:34:10.005183
personalfinance,"Weekday Help and Victory Thread for the week of June 30, 2025",2,https://www.reddit.com/r/personalfinance/comments/1lo4klv/weekday_help_and_victory_thread_for_the_week_of/,IndexBot,2025-06-30 11:00:03,2025-07-02 10:34:10.005183
personalfinance,I feel like I am actually drowning. I made the most irresponsible financial decision ever. I need advice.,620,https://www.reddit.com/r/personalfinance/comments/1lph76j/i_feel_like_i_am_actually_drowning_i_made_the/,Adorable-Tip-3708,2025-07-01 23:46:52,2025-07-02 10:34:10.005183
personalfinance,Owning vs. renting. What’s actually worth it in the long run?,50,https://www.reddit.com/r/personalfinance/comments/1lpv7vw/owning_vs_renting_whats_actually_worth_it_in_the/,Big_Display5581,2025-07-02 12:59:52,2025-07-02 10:34:10.005183
personalfinance,My mom has nothing and needs assisted living ASAP,785,https://www.reddit.com/r/personalfinance/comments/1lp7pew/my_mom_has_nothing_and_needs_assisted_living_asap/,Easy_Cherry2353,2025-07-01 17:24:30,2025-07-02 10:34:10.005183
personalfinance,How I started an emergency fund with no extra income,43,https://www.reddit.com/r/personalfinance/comments/1lpq576/how_i_started_an_emergency_fund_with_no_extra/,Ayman970,2025-07-02 08:03:38,2025-07-02 10:34:10.005183
personalfinance,Parents considering a reverse mortgage,339,https://www.reddit.com/r/personalfinance/comments/1lpbkwf/parents_considering_a_reverse_mortgage/,arrozconpoyo,2025-07-01 19:52:38,2025-07-02 10:34:10.005183
personalfinance,Checking accounts in my name that I didn’t know about,18,https://www.reddit.com/r/personalfinance/comments/1lppktx/checking_accounts_in_my_name_that_i_didnt_know/,Dull_Grape7120,2025-07-02 07:24:26,2025-07-02 10:34:10.005183
personalfinance,Could I please get a quick pulse check on my car insurance? It seems really high...,63,https://www.reddit.com/r/personalfinance/comments/1lpgkoa/could_i_please_get_a_quick_pulse_check_on_my_car/,l4fashion,2025-07-01 23:18:15,2025-07-02 10:34:10.005183
personalfinance,Company offered Relocation package.,63,https://www.reddit.com/r/personalfinance/comments/1lpdpqv/company_offered_relocation_package/,Rooster-thunder,2025-07-01 21:15:58,2025-07-02 10:34:10.005183
personalfinance,Importance of an Emergency Fund,159,https://www.reddit.com/r/personalfinance/comments/1lp5pht/importance_of_an_emergency_fund/,CPA_Throwaway_7,2025-07-01 16:09:34,2025-07-02 10:34:10.005183
personalfinance,My Credit Union is making me log in with my husband’s info to access our joint account. Is that normal?,4,https://www.reddit.com/r/personalfinance/comments/1lpw1wu/my_credit_union_is_making_me_log_in_with_my/,Sarah-Who-Is-Large,2025-07-02 13:36:14,2025-07-02 10:34:10.005183
personalfinance,Investing as a stay at home mom- am I being too conservative,3,https://www.reddit.com/r/personalfinance/comments/1lpvlmo/investing_as_a_stay_at_home_mom_am_i_being_too/,sunshinethrowup,2025-07-02 13:16:27,2025-07-02 10:34:10.005183
personalfinance,Money once listed on Texas Unclaimed Property is no longer listed??,3,https://www.reddit.com/r/personalfinance/comments/1lpvzil/money_once_listed_on_texas_unclaimed_property_is/,SimionMcBitchticuffs,2025-07-02 13:33:21,2025-07-02 10:34:10.005183
personalfinance,Left the US 4 yrs ago- just got a collection letter from Caine and Weiner for a debt to the City of LA,242,https://www.reddit.com/r/personalfinance/comments/1loy5l8/left_the_us_4_yrs_ago_just_got_a_collection/,Illustrious_Dare1022,2025-07-01 10:28:18,2025-07-02 10:34:10.005183
personalfinance,Can I take a sabbatical from work with some savings,89,https://www.reddit.com/r/personalfinance/comments/1lp4s66/can_i_take_a_sabbatical_from_work_with_some/,Specialist-Turnip216,2025-07-01 15:34:05,2025-07-02 10:34:10.005183
personalfinance,Saving for retirement as a freelancer,2,https://www.reddit.com/r/personalfinance/comments/1lptqif/saving_for_retirement_as_a_freelancer/,kitachi3,2025-07-02 11:47:28,2025-07-02 10:34:10.005183
personalfinance,Thoughts on next steps or current advice 19 y/o,2,https://www.reddit.com/r/personalfinance/comments/1lpt63k/thoughts_on_next_steps_or_current_advice_19_yo/,TheRaider00,2025-07-02 11:17:12,2025-07-02 10:34:10.005183
personalfinance,I need help organizing my budget,2,https://www.reddit.com/r/personalfinance/comments/1lpszn8/i_need_help_organizing_my_budget/,FlakyCourse5973,2025-07-02 11:07:24,2025-07-02 10:34:10.005183
personalfinance,How do I think before I spend?,1,https://www.reddit.com/r/personalfinance/comments/1lpxe3l/how_do_i_think_before_i_spend/,Important-Divide3562,2025-07-02 14:32:05,2025-07-02 10:34:10.005183
antiwork,"X, Meta, and CCP-affiliated content is no longer permitted",49230,https://www.reddit.com/r/antiwork/comments/1i79k8z/x_meta_and_ccpaffiliated_content_is_no_longer/,AutoModerator,2025-01-22 12:02:29,2025-07-02 10:34:10.005183
antiwork,Come check out our Discord!,64,https://www.reddit.com/r/antiwork/comments/1j075ao/come_check_out_our_discord/,AutoModerator,2025-02-28 13:02:45,2025-07-02 10:34:10.005183
antiwork,"As a Canadian watching US work culture, I'm genuinely confused how you all haven't burned everything down",2890,https://www.reddit.com/r/antiwork/comments/1lpukjb/as_a_canadian_watching_us_work_culture_im/,zchrisiscool,2025-07-02 12:29:13,2025-07-02 10:34:10.005183
antiwork,A poster I felt moved to make after current events,9176,https://i.redd.it/eez071nykcaf1.jpeg,Accidents_Happen,2025-07-01 23:30:34,2025-07-02 10:34:10.005183
antiwork,Rude to just do your job lol,2243,https://i.redd.it/q63725myacaf1.jpeg,Jvinsnes,2025-07-02 05:27:16,2025-07-02 10:34:10.005183
antiwork,"While We Work Ourselves to Death, Billionaires Throw $50M Weddings. The System Is Designed to Collapse on Us",727,/r/economy/comments/1lprlkk/the_great_unraveling_modern_economy_on_the_brink/,No-Bluebird-5404,2025-07-02 10:36:31,2025-07-02 10:34:10.005183
antiwork,"The GOP’s goal is to 1) privatize everything so their donors can profit off you while making you work harder, and 2) slash your services to fund tax breaks for their wealthy friends. Fox News screams “socialism” to keep you cheering while they steal from you. How are people still falling for this?",335,https://i.redd.it/vwvh4n7xpgaf1.jpeg,Parking_Truck1403,2025-07-02 13:25:29,2025-07-02 10:34:10.005183
antiwork,Trump's 'Big Beautiful Bill' Is Outright Class Warfare,3565,https://zeteo.com/p/trumps-big-beautiful-bill-is-outright,AdhesivenessLevel321,2025-07-02 00:12:44,2025-07-02 10:34:10.005183
antiwork,"Vacation will henceforth be known as ""potentially damaging to your career"" ""micro-retirements"".",326,https://www.reddit.com/r/antiwork/comments/1lptihq/vacation_will_henceforth_be_known_as_potentially/,vjason,2025-07-02 11:35:40,2025-07-02 10:34:10.005183
antiwork,Spain and Brazil push global action to tax the super-rich and curb inequality,527,https://news.un.org/en/story/2025/07/1165146,Maxwellsdemon17,2025-07-02 08:43:59,2025-07-02 10:34:10.005183
antiwork,New work perk just dropped!,238,https://i.redd.it/831cz3q45gaf1.jpeg,MutaitoSensei,2025-07-02 11:28:56,2025-07-02 10:34:10.005183
antiwork,People call hard-work a ‘scam’ and no longer think it will lead to a better life,1713,https://www.unilad.com/community/life/hard-work-better-life-scam-330925-20240901,GoranPersson777,2025-07-01 22:57:26,2025-07-02 10:34:10.005183
antiwork,Boss texted me to come in on my day off at 11:47pm,131,https://www.reddit.com/r/antiwork/comments/1lpuwz2/boss_texted_me_to_come_in_on_my_day_off_at_1147pm/,Aggressive-Bit-7518,2025-07-02 12:45:47,2025-07-02 10:34:10.005183
antiwork,"""Conservatives""? My ass.",2415,https://www.reddit.com/r/antiwork/comments/1lpd4nn/conservatives_my_ass/,Parking_Truck1403,2025-07-01 20:53:01,2025-07-02 10:34:10.005183
antiwork,Was fired after saying no to duties outside my job description,224,https://www.reddit.com/r/antiwork/comments/1lpojio/was_fired_after_saying_no_to_duties_outside_my/,Jackvultar,2025-07-02 06:16:46,2025-07-02 10:34:10.005183
antiwork,Hot Take: If You’re Autistic/ADHD With No Family Support — Be Ruthless. Forget the Dream.,7931,https://www.reddit.com/r/antiwork/comments/1lozi4d/hot_take_if_youre_autisticadhd_with_no_family/,campusSixEight,2025-07-01 11:45:13,2025-07-02 10:34:10.005183
antiwork,The BBB (big beautiful bill) will hurt the poor the most.,1011,https://www.reddit.com/r/antiwork/comments/1lpcbhs/the_bbb_big_beautiful_bill_will_hurt_the_poor_the/,WantToVent,2025-07-01 20:21:16,2025-07-02 10:34:10.005183
antiwork,"IBM Lays Off 8,000 Employees for AI Automation, Only to Rehire Just as Many Soon After Because Of…",697,https://dailygalaxy.com/2025/06/ibm-lays-off-8000-employees-for-ai-automation-only-to-rehire-just-as-many-soon-after-because-of/,CryptoEmpathy7,2025-07-01 21:42:52,2025-07-02 10:34:10.005183
antiwork,'You Have The Same 24 Hrs As Jeff Bezos',1818,https://www.reddit.com/r/antiwork/comments/1lp2i4n/you_have_the_same_24_hrs_as_jeff_bezos/,Footboler,2025-07-01 14:03:16,2025-07-02 10:34:10.005183
antiwork,"After 12 years at Kohl’s, my wife was blindsided with a pre-PIP and lowball severance is this normal behavior?",73,https://www.reddit.com/r/antiwork/comments/1lpoisu/after_12_years_at_kohls_my_wife_was_blindsided/,Diligent-Novel-4678,2025-07-02 06:15:28,2025-07-02 10:34:10.005183
anime,"Anime Questions, Recommendations, and Discussion - July 02, 2025",14,https://www.reddit.com/r/anime/comments/1lprvkw/anime_questions_recommendations_and_discussion/,AnimeMod,2025-07-02 10:00:42,2025-07-02 10:34:10.005183
anime,D4DJ - Anime of the Week,34,https://www.reddit.com/r/anime/comments/1lntgmp/d4dj_anime_of_the_week/,AnimeMod,2025-06-30 00:00:35,2025-07-02 10:34:10.005183
anime,The World of KyoAni Exhibition - Special Visual!,252,https://i.redd.it/6121w64vugaf1.png,U_n_d_e_r_s_c_o_rr,2025-07-02 13:53:14,2025-07-02 10:34:10.005183
anime,Clevatess: Majuu no Ou to Akago to Shikabane no Yuusha • Clevatess - Episode 1 discussion,120,https://www.reddit.com/r/anime/comments/1lptj6v/clevatess_majuu_no_ou_to_akago_to_shikabane_no/,AutoLovepon,2025-07-02 11:36:41,2025-07-02 10:34:10.005183
anime,"""Meikyu No Shiori"" Orginal Film Announced (Teaser Visual)",68,https://i.redd.it/1911s512lgaf1.jpeg,Dazzling-Primary4909,2025-07-02 12:58:35,2025-07-02 10:34:10.005183
anime,Crunchyroll's German Necronomico and the Cosmic Horror Show Subtitles Lists 'ChatGPT',1184,https://www.animenewsnetwork.com/news/2025-07-01/crunchyroll-german-necronomico-and-the-cosmic-horror-show-subtitles-lists-chatgpt/.226206,Aquason,2025-07-01 20:34:25,2025-07-02 10:34:10.005183
anime,"Voice actress Atsumi Tanezaki (Anya, Frieren) limits activities due to poor health",4373,https://x.com/tanezakiatsumi/status/1939988690266464377,fuzaco,2025-07-01 13:28:52,2025-07-02 10:34:10.005183
anime,Industrialist's Dreams and Robot's Tears (Key the Metal Idol) (NSFW),479,https://v.redd.it/6l8m8lbopcaf1,JustAnswerAQuestion,2025-07-01 23:58:33,2025-07-02 10:34:10.005183
anime,Takopi & Shizuka (Takopi's Original Sin) fanart by me,282,https://i.redd.it/p6v5fp8dwcaf1.jpeg,Lidrol14,2025-07-02 00:34:32,2025-07-02 10:34:10.005183
anime,"Detective These Days Are Crazy! (Mattaku Saikin no Tantei to Kitara) Creditless ED - GORI☆GORI Feez e-Girl!!"" by Mashiro (CV: Kana Hanazawa) VS Yukaina Ojisan-tachi (CV: Tomokazu Sugita)",26,https://www.youtube.com/watch?v=63MdWK5-Ogk,Time_Fracture,2025-07-02 12:55:11,2025-07-02 10:34:10.005183
anime,"""Sousou no Frieren: ●● no Mahou"" #15",39,https://www.youtube.com/watch?v=Cr_8koqGgTA,mr_beanoz,2025-07-02 10:14:46,2025-07-02 10:34:10.005183
anime,"See You Tomorrow at the Food Court (Food Court de, Mata Ashita) Creditless ED - Tonariawase by Wada (CV: Hiyori Miyazaki) & Yamamoto (CV: Yoshino Aoyama)",21,https://www.youtube.com/watch?v=CLVx27ALbgs,Time_Fracture,2025-07-02 12:58:51,2025-07-02 10:34:10.005183
anime,My Thoughts on Aharen Is Indecipherable Season 1,19,https://www.reddit.com/r/anime/comments/1lps5zs/my_thoughts_on_aharen_is_indecipherable_season_1/,SaberLover1000,2025-07-02 10:18:15,2025-07-02 10:34:10.005183
anime,B Gata H Kei eyecatches,590,https://youtu.be/ffFdaWlQquU,dzentore,2025-07-01 15:49:16,2025-07-02 10:34:10.005183
anime,Best Girl of Spring 2025: Seasonal Salt! Shiny sixty-four!,101,https://www.reddit.com/r/anime/comments/1lphuam/best_girl_of_spring_2025_seasonal_salt_shiny/,changshiyixia,2025-07-02 00:16:38,2025-07-02 10:34:10.005183
anime,Mattaku Saikin no Tantei to Kitara • Detectives These Days Are Crazy! - Episode 1 discussion,407,https://www.reddit.com/r/anime/comments/1lp38q5/mattaku_saikin_no_tantei_to_kitara_detectives/,AutoLovepon,2025-07-01 14:33:49,2025-07-02 10:34:10.005183
anime,UPDATED Crunchyroll Summer 2025 Anime Season Lineup (01-07-25),256,https://www.crunchyroll.com/news/seasonal-lineup/2025/6/18/summer-2025-anime-crunchyroll,Automatic_Use_9427,2025-07-01 16:28:45,2025-07-02 10:34:10.005183
anime,“The Dangers in My Heart” Compilation Movie Key Visual,2723,https://i.redd.it/zovtvg1ih6af1.jpeg,zenzen_0,2025-07-01 03:00:29,2025-07-02 10:34:10.005183
anime,「Ruri no Houseki」Character PV・Tanigawa Ruri（CV：Nemoto Miyari）,59,https://www.youtube.com/watch?v=ugbtVrrgeCs,inspyral,2025-07-01 23:37:09,2025-07-02 10:34:10.005183
anime,Hitozuma no Kuchibiru wa Kan Chuuhai no Aji ga Shite • Chuhai Lips - Episode 1 discussion,217,https://www.reddit.com/r/anime/comments/1lp5vh1/hitozuma_no_kuchibiru_wa_kan_chuuhai_no_aji_ga/,AutoLovepon,2025-07-01 16:15:52,2025-07-02 10:34:10.005183
wow,Reset Recruitment,10,https://www.reddit.com/r/wow/comments/1lou4kx/reset_recruitment/,AutoModerator,2025-07-01 06:00:43,2025-07-02 10:34:10.005183
wow,Megathread: Collector's Bounty,495,https://www.reddit.com/r/wow/comments/1lpavrf/megathread_collectors_bounty/,WorldofWarcraftMods,2025-07-01 19:25:11,2025-07-02 10:34:10.005183
wow,The whole world changed that day at the Broken Shore,229,https://i.redd.it/gi8yblh6qfaf1.png,Professional_Ease130,2025-07-02 12:26:31,2025-07-02 10:34:10.005183
wow,"Okay Blizzard, your mockery has been fun. Just add them!",173,https://i.redd.it/u88mds5gngaf1.png,El_grandepadre,2025-07-02 13:12:17,2025-07-02 10:34:10.005183
wow,Will new customization for all races ever happen again? What are those hairstyles?,229,https://i.redd.it/mp73a9u1qfaf1.png,RedFlagSupreme,2025-07-02 10:21:00,2025-07-02 10:34:10.005183
wow,"I'm once again addicted to this game. Genuinely having so much fun, similar to 16 years ago. War Within has been STier for me. 🤗",114,https://i.redd.it/uc1pcgyfogaf1.png,Immediate-Injury8753,2025-07-02 13:21:32,2025-07-02 10:34:10.005183
wow,The double drop rates seems way too literal Lol,338,https://i.redd.it/v9r0swbrteaf1.png,Blaze_studios,2025-07-02 07:04:07,2025-07-02 10:34:10.005183
wow,Holy crap the new collectors event is awesome! First run,4952,https://i.redd.it/54074il8jaaf1.jpeg,solebiscuits,2025-07-01 16:37:20,2025-07-02 10:34:10.005183
wow,Everyone after Collector's Bounty,2375,https://i.redd.it/id7flp2rkbaf1.png,OpDesSto,2025-07-01 20:08:55,2025-07-02 10:34:10.005183
wow,What‘s the most wholesome Zone in your Opinion? It‘s Mulgore for me!,172,https://i.redd.it/lmw8qbjpifaf1.jpeg,SpecificUnlucky3260,2025-07-02 09:23:20,2025-07-02 10:34:10.005183
wow,Playing through MOP classic pre-patch and I like this guys attitude. He seems like a very calm and reasonable warchief i'll get to love in the future.,859,https://i.redd.it/xqmr2wsercaf1.png,Siggythenomad,2025-07-02 00:07:17,2025-07-02 10:34:10.005183
