subreddit,title,score,url,author,created_utc,extracted_at
politics,‘We Will Not Accept This Intimidation’: Zohran Mamdani Responds to Trump’s Arrest Threat,2510,https://time.com/7299415/zohran-mamdani-trump-arrest-threat/,gradientz,2025-07-02 04:21:04,2025-07-02 10:34:10.005183
politics,More than half of Americans - and 83% of Democrats - say ICE has gone ‘too far’ in arresting migrants: poll,5486,https://www.independent.co.uk/news/world/americas/us-politics/ice-arrests-democrats-republicans-poll-b2780678.html,Strominater,2025-07-01 23:34:08,2025-07-02 10:34:10.005183
politics,"Trump Says He Gave Iran Permission to Bomb U.S. Base in Qatar and…Well, Mostly Crickets?",827,https://talkingpointsmemo.com/morning-memo/trump-says-he-gave-iran-permission-to-bomb-u-s-base-in-qatar-andwell-mostly-crickets?fbclid=IwQ0xDSwLR14pjbGNrAtHXhmV4dG4DYWVtAjExAAEel8ghspc8Lds9-LqmHegRrnbpWkFSjMdzX_Ee8OF7EddOxrWfCk-5SiRFyU0_aem_B0qOBpIsyH9xM8u7LOcSqA,undercurrents,2025-07-02 09:28:12,2025-07-02 10:34:10.005183
politics,McConnell is OK with cutting Medicaid because he's never struggled like us,418,https://www.courier-journal.com/story/opinion/contributors/2025/07/02/mcconnell-vote-trump-big-beautiful-bill-kentucky-medicaid-cuts/84422668007/,PoliticalScienceProf,2025-07-02 12:49:03,2025-07-02 10:34:10.005183
politics,"Trump Says Zohran Mamdani Will Be Arrested If He Seeks To Prevent ICE From Making Arrests In NYC. Mamdani said during his campaign that he would ""kick fascist ICE"" out of the city.",10863,https://www.latintimes.com/trump-says-zohran-mamdani-will-arrested-if-he-seeks-prevent-ice-making-arrests-nyc-585982,Aggravating_Money992,2025-07-01 18:31:20,2025-07-02 10:34:10.005183
politics,Lawrence O’Donnell: This Baffling Trump Answer Shows His Mind ‘Does Not Work’ |  The MSNBC host unleashed a scathing on-air takedown of the president’s mental fitness.,323,https://www.thedailybeast.com/lawrence-odonnell-this-baffling-trump-answer-shows-his-mind-does-not-work/,Murky-Site7468,2025-07-02 12:32:14,2025-07-02 10:34:10.005183
politics,Wisconsin Supreme Court’s liberal majority strikes down 176-year-old abortion ban,265,https://apnews.com/article/wisconsin-abortion-ban-1849-01658358639a63db7df92aeec34c612d?taid=6865336959119f0001a6a5d4&utm_campaign=TrueAnthem&utm_medium=AP&utm_source=Twitter,mvanigan,2025-07-02 13:27:20,2025-07-02 10:34:10.005183
wallstreetbets,"Daily Discussion Thread for July 02, 2025",171,https://www.reddit.com/r/wallstreetbets/comments/1lprvvj/daily_discussion_thread_for_july_02_2025/,wsbapp,2025-07-02 10:01:06,2025-07-02 10:34:10.005183
wallstreetbets,🇺🇸 Key Notes from Powell’s Speech 👇,2223,https://i.redd.it/20b2emfymfaf1.jpeg,Final-Big2785,2025-07-02 09:47:50,2025-07-02 10:34:10.005183
wallstreetbets,Tesla's quarterly deliveries fall more sharply than analysts' estimates,715,https://ca.finance.yahoo.com/news/teslas-quarterly-deliveries-fall-sharper-130859981.html?guce_referrer=aHR0cHM6Ly93d3cuZ29vZ2xlLmNvbS8&guce_referrer_sig=AQAAAGXjp03jQFvAvBbFfJ3MbDCB-rR1tb1R6vVufhnnM-Wusm3EnB1slxvL1RxSN1Z12Bp3w2s29YfAjUWr-unMpvQ_qu1rZPxSe_qfQdQco4Jmyf6XFJXx5WR2zdxOdN2rewNt3EGbNisd7R0Ln83p9k2vV1InbUBcKMiOT6Eu9UVF,breadlover96,2025-07-02 13:16:12,2025-07-02 10:34:10.005183
wallstreetbets,$150k+ in Upwork - Nine Tailed Fox/Naruto Plot Armor Pattern Spotted - $17+ Breakout,103,https://www.reddit.com/gallery/1lpsbxa,AleaBito,2025-07-02 10:28:14,2025-07-02 10:34:10.005183
wallstreetbets,Buy 12k of SPY puts so we can rally more,138,https://i.redd.it/i0pr1u634eaf1.jpeg,Glad_Ad_4939,2025-07-02 04:39:32,2025-07-02 10:34:10.005183
wallstreetbets,Nana didn’t hear no bell. INTC yolo.,1062,https://i.redd.it/o7j26bqg8aaf1.jpeg,versello,2025-07-01 15:36:57,2025-07-02 10:34:10.005183
wallstreetbets,$17k MSTR YOLO $12k Win Overnight,15,https://www.reddit.com/r/wallstreetbets/comments/1lpwn8x/17k_mstr_yolo_12k_win_overnight/,Jebusfreek666,2025-07-02 14:01:30,2025-07-02 10:34:10.005183
wallstreetbets,Skechers' Sketchy Takeover,17,https://www.reddit.com/r/wallstreetbets/comments/1lpu35d/skechers_sketchy_takeover/,EconomiadeVerdad,2025-07-02 12:05:12,2025-07-02 10:34:10.005183
wallstreetbets,Shout out Elons dealer,343,https://i.redd.it/c5la7hb93baf1.jpeg,throwawayben1992,2025-07-01 18:29:32,2025-07-02 10:34:10.005183
wallstreetbets,"What Are Your Moves Tomorrow, July 02, 2025",264,https://www.reddit.com/r/wallstreetbets/comments/1lpbpcd/what_are_your_moves_tomorrow_july_02_2025/,wsbapp,2025-07-01 19:57:33,2025-07-02 10:34:10.005183
wallstreetbets,Never give up. $25k ->$10k -> $75k,670,https://www.reddit.com/gallery/1lp3rql,BeneficialBuffalo815,2025-07-01 14:55:35,2025-07-02 10:34:10.005183
wallstreetbets,To Catch a Short: $HOOD Edition,109,https://i.redd.it/ds2rs366ycaf1.jpeg,Anxious-Ad-7039,2025-07-02 00:44:40,2025-07-02 10:34:10.005183
wallstreetbets,I think I did it again,4561,https://www.reddit.com/gallery/1loscsg,Chummyterror,2025-07-01 04:14:22,2025-07-02 10:34:10.005183
wallstreetbets,$17.5K on Google,218,https://i.redd.it/ha70kprwfbaf1.png,dynamic-burrito,2025-07-01 19:41:46,2025-07-02 10:34:10.005183
wallstreetbets,Good enough to post good enough to sell,158,https://i.redd.it/yucvqvkgybaf1.jpeg,noobeater5,2025-07-01 21:24:26,2025-07-02 10:34:10.005183
wallstreetbets,What companies will benefit from the big beautiful bill? What is everyone holding?,567,https://www.reddit.com/r/wallstreetbets/comments/1lp2ztd/what_companies_will_benefit_from_the_big/,NonimiJewelry,2025-07-01 14:23:39,2025-07-02 10:34:10.005183
wallstreetbets,Figma S1 Filed,104,https://www.reddit.com/r/wallstreetbets/comments/1lpgn5w/figma_s1_filed/,Strict_Air_333,2025-07-01 23:21:19,2025-07-02 10:34:10.005183
wallstreetbets,TSLA puts have been fun this month,97,https://www.reddit.com/gallery/1lpgoai,Delulu_Ber_Ramblings,2025-07-01 23:22:46,2025-07-02 10:34:10.005183
wallstreetbets,F u unh,164,https://i.redd.it/5xz2m23fhbaf1.jpeg,noClip2,2025-07-01 19:48:55,2025-07-02 10:34:10.005183
wallstreetbets,Bloody CRCL bullish Could be a dream before I die.,5,https://i.redd.it/4b51sjwxxgaf1.png,awtrooper,2025-07-02 14:11:51,2025-07-02 10:34:10.005183
todayilearned,"TIL Columbo's signature catchphrase ""Just one more thing"" originated because a scene was too short, and the writers didn't want to retype the script on a typewriter, so they just had him return and add the line at the end as if he'd forgotten something.",2933,https://en.wikipedia.org/wiki/Columbo_(character),LookAtThatBacon,2025-07-02 09:53:47,2025-07-02 10:34:10.005183
todayilearned,"TIL that, immediately after John F. Kennedy was assassinated, an order came down from the Secretary of the Navy to destroy all personal logs associated with the use of the presidential yacht USS Sequoia during the Kennedy Administration.",30645,https://en.wikipedia.org/wiki/USS_Sequoia_(presidential_yacht)?wprov=sfti1#Kennedy_Administration,the_dj_zig,2025-07-02 01:32:09,2025-07-02 10:34:10.005183
todayilearned,"TIL the UK tried to ban raves in 1994, with an act criminalizing gatherings where '""music"" includes sounds wholly or predominantly characterised by the emission of a succession of repetitive beats.'",2587,https://en.wikipedia.org/wiki/Criminal_Justice_and_Public_Order_Act_1994,ug_unb,2025-07-02 09:26:39,2025-07-02 10:34:10.005183
todayilearned,TIL that Stephen King was so obsessed with Lou Bega’s Mambo No. 5 that his wife threatened to divorce him over it.,38567,https://variety.com/2023/music/news/stephen-king-wife-threatened-divorce-mambo-no-5-1235714923/,DangerNoodle1993,2025-07-01 23:30:47,2025-07-02 10:34:10.005183
todayilearned,"TIL that in 2003 Iraqi Insurgents attempted to shoot down a European Air Transport Airbus A300 cargo plane flying from Baghdad to Bahrain, but ultimately failed when the plane was able to return to Baghdad and land with severe damage. The firing of the missle was all caught on camera!",2183,https://www.youtube.com/watch?v=0N5Pd6t8WHw,Comfortable-Duty2231,2025-07-02 05:25:31,2025-07-02 10:34:10.005183
todayilearned,TIL that despite Antarctica going undiscovered for hundreds of millenia the first two claims of its discovery occured only 3 days apart.,9611,https://en.wikipedia.org/wiki/Antarctica#History_of_exploration,temujin94,2025-07-01 21:28:05,2025-07-02 10:34:10.005183
todayilearned,TIL only one Navy ship in active duty have sank an enemy ship: USS Constitution. (also the oldest active Navy ship),1732,https://www.usni.org/magazines/naval-history-magazine/2022/august/old-still-going-strong,Warcraft_Fan,2025-07-02 05:07:47,2025-07-02 10:34:10.005183
todayilearned,"TIL that Colonel Sanders once studied Law and served as a Justice of the Peace in Little Rock, but his legal career ended abruptly after he got into a courtroom brawl with a client.",576,https://www.mashed.com/942287/the-incident-that-destroyed-the-real-colonel-sanders-law-career/,DangerNoodle1993,2025-07-02 09:38:55,2025-07-02 10:34:10.005183
todayilearned,"TIL that the phenomenon where a landline phone's cord forms a kink and gets twisted in the opposite direction of the rest of the cord is called ""tendril perversion""",2363,https://en.wikipedia.org/wiki/Tendril_perversion,Smaptimania,2025-07-02 01:18:02,2025-07-02 10:34:10.005183
todayilearned,TIL Dolphins can only hold their breath for 10 minutes,3271,https://www.theswimguide.org/2016/09/20/mammals-holding-breath-underwater?v2,DeScepter,2025-07-01 23:20:00,2025-07-02 10:34:10.005183
todayilearned,TIL that actor Joe Spinell was hired to play a hitman in The Godfather and Francis Ford Coppola liked him so much that he hired him on as a day player for 6 months of shooting.  He wound up being the second highest paid actor in the film after Marlon Brando,1766,https://en.wikipedia.org/wiki/Joe_Spinell#Early_1970s_to_1982:_Rise_to_prominence,licecrispies,2025-07-02 01:55:27,2025-07-02 10:34:10.005183
todayilearned,"TIL of Beatrice Muller, a New Jersey widow who became a permanet resident of the Cunard ocean liner Queen Elizabeth 2. When her husband retired the pair went on the ship's world cruise every year until he died on board in 1999. From 2000 she lived permanently on the ship until it was retired in 2008",6173,https://en.wikipedia.org/wiki/Beatrice_Muller,ClandesTyne,2025-07-01 19:23:32,2025-07-02 10:34:10.005183
todayilearned,TIL That peanut-free schools don't decrease risk of allergic reactions. The only intervention which has been shown to decrease reactions across all ages is use of a peanut-free table.,9913,https://www.jacionline.org/article/S0091-6749(17)30666-8/fulltext,1039smoothielumps,2025-07-01 17:12:21,2025-07-02 10:34:10.005183
todayilearned,TIL Bloom Was a Secretary for 67 Years who had amassed a secret fortune of $9 Million By Copying Boss' Investments.,5955,https://www.cbc.ca/radio/asithappens/as-it-happens-monday-full-episode-1.4651457/96-year-old-secretary-secretly-grew-9m-fortune-then-donates-to-students-1.4651864,TitaniumArse,2025-07-01 19:11:00,2025-07-02 10:34:10.005183
todayilearned,TIL the first known surviving nonuplets (9 children) were born in Morocco in 2021.,977,https://en.wikipedia.org/wiki/Halima_Ciss%C3%A9?wprov=sfla1,CeeArthur,2025-07-02 04:17:26,2025-07-02 10:34:10.005183
todayilearned,TIL that a man broke into the Buckingham Palace twice in a month and the alarm was set off but dismissed as false alarm both times,7642,https://en.wikipedia.org/wiki/Michael_Fagan#Break-ins,zyl1024,2025-07-01 17:00:52,2025-07-02 10:34:10.005183
todayilearned,"TIL after being signed to a record label at the age of 12, Aaliyah's uncle introduced her to R. Kelly who ended up being lead songwriter and producer of her debut album; Age Ain't Nothing but a Number",25873,https://en.wikipedia.org/wiki/Aaliyah,MajesticBread9147,2025-07-01 12:44:56,2025-07-02 10:34:10.005183
todayilearned,"TIL about the ""Phantom of Heilbronn,"" a mysterious female serial killer suspect who baffled German police for years,
until it turned out the DNA evidence was contaminated by factory workers making the cotton swabs used in forensic tests.",458,https://en.wikipedia.org/wiki/Phantom_of_Heilbronn,TheBarman8,2025-07-02 06:26:29,2025-07-02 10:34:10.005183
todayilearned,"TIL In 1907, Grace Oakeshott, a British women's rights activist, faked her death to run off with her extramarital lover. It seems her husband was in on the plan, as both found it preferable to a divorce. Grace and her lover moved to New Zealand where they had 3 children before Grace's death in 1929.",1500,https://en.wikipedia.org/wiki/Grace_Oakeshott,Ill_Definition8074,2025-07-01 22:28:45,2025-07-02 10:34:10.005183
todayilearned,"TIL Thomas Paine, author of Common Sense, died in obscurity, was dug up by an admirer, shipped to England, then sold with a bankrupt man's house. His remains vanished and may have been turned into souvenirs.",2561,https://blogs.loc.gov/headlinesandheroes/2019/04/the-bones-of-thomas-paine/,gonejahman,2025-07-01 19:20:53,2025-07-02 10:34:10.005183
nottheonion,"Kremlin welcomes reported pause in US arms shipments to Ukraine, says it brings war's end closer",2028,https://kyivindependent.com/kremlin-welcomes-halt-in-us-arms-shipments-to-ukraine-says-it-brings-end-of-war-closer/,IlustriousCoffee,2025-07-02 12:30:23,2025-07-02 10:34:10.005183
nottheonion,Republican Senator Tells House Not To Vote For Bill She Just Voted For,59531,https://www.newsweek.com/big-beautiful-bill-donald-trump-lisa-murkowski-vote-2093246,PoseidonJC,2025-07-01 21:22:22,2025-07-02 10:34:10.005183
nottheonion,Travis Kelce Says the ‘Hardest’ Part of Hosting ‘SNL’ Was the Table Read Because He ‘Can’t Really Read That Well’,5688,https://variety.com/2025/tv/news/travis-kelce-hardest-part-hosting-snl-cant-really-read-1236445700/,smsloth,2025-07-02 01:45:35,2025-07-02 10:34:10.005183
nottheonion,"Schumer forces name change for 'big, beautiful bill' moments before it passes",8456,https://www.foxnews.com/politics/schumer-forces-name-change-big-beautiful-bill-moments-before-passes,mawhrinskeleton,2025-07-01 22:57:29,2025-07-02 10:34:10.005183
nottheonion,"Drug cartel hacked FBI official’s phone to track and kill informants, report says",629,https://arstechnica.com/security/2025/06/mexican-drug-cartel-hacked-fbi-officials-phone-to-track-informant-report-says/,ReallyBugged0ut,2025-07-02 11:54:10,2025-07-02 10:34:10.005183
nottheonion,Crunchyroll Accidentally Reveals They've Been Using ChatGPT for Sub Translations,5821,https://www.cbr.com/crunchyroll-chatgpt-sub-anime/,shoofinsmertz,2025-07-01 23:45:29,2025-07-02 10:34:10.005183
nottheonion,Deutsche Bahn train hits 405 km/h without falling to bits,1161,https://www.theregister.com/2025/06/30/deutsche_bahn_test/,Stardustger,2025-07-02 07:33:26,2025-07-02 10:34:10.005183
nottheonion,Kristi Noem claims cannibal illegal immigrant ‘started to eat himself’ during deportation flight,11471,https://www.hindustantimes.com/world-news/us-news/kristi-noem-claims-cannibal-illegal-immigrant-started-to-eat-himself-during-deportation-flight-101751396814237.html,rmuktader,2025-07-01 20:17:44,2025-07-02 10:34:10.005183
nottheonion,"RFK Jr.‘s health department calls Nature “junk science,” cancels subscriptions",5992,https://arstechnica.com/health/2025/07/rfk-jr-s-health-department-calls-nature-junk-science-cancels-subscriptions/,GarlicoinAccount,2025-07-01 22:26:08,2025-07-02 10:34:10.005183
nottheonion,"Harvey Epstein wins NYC Council primary, defeating Anthony Weiner’s comeback bid",3670,https://apnews.com/article/anthony-weiner-nyc-council-harvey-epstein-b66321c186ef550c01910e76adaef4f0,rutherfraud1876,2025-07-01 20:49:55,2025-07-02 10:34:10.005183
nottheonion,US sprinter gets modeling offer after penis fell out of shorts during race,1596,https://www.themirror.com/sport/other-sport/chris-robinson-sprinter-penis-underwear-1236778,choo4twentychoo,2025-07-02 01:01:13,2025-07-02 10:34:10.005183
nottheonion,"'Stop sending unsolicited urine samples', says GP",189,https://news.stv.tv/north/stop-sending-unsolicited-urine-samples-says-gp,WetBreadCollective,2025-07-02 10:25:25,2025-07-02 10:34:10.005183
nottheonion,July 4th events across LA area canceled over ICE raid fears,1883,https://www.axios.com/2025/07/01/ice-raids-july-4th,Datzookman,2025-07-01 21:33:41,2025-07-02 10:34:10.005183
nottheonion,US sprinter gets modeling offer after penis fell out of shorts during race,673,https://www.themirror.com/sport/other-sport/chris-robinson-sprinter-penis-underwear-1236778,boricimo,2025-07-02 01:45:19,2025-07-02 10:34:10.005183
nottheonion,Snake on a plane delays a flight in Australia,396,https://apnews.com/article/virgin-australia-snake-plane-melbourne-brisbane-9fec54edc5a7c7f6f9734fa76e0d3e45,rslarson147,2025-07-02 03:10:27,2025-07-02 10:34:10.005183
nottheonion,Brussels’ Atomium closes early because its balls are too hot,3391,https://dnyuz.com/2025/07/01/brussels-atomium-closes-early-because-its-balls-are-too-hot/,Forsaken-Medium-2436,2025-07-01 14:08:21,2025-07-02 10:34:10.005183
nottheonion,"Ohio Amish man charged with murder after woman, 28, found dead with goat",51,https://wwmt.com/news/nation-world/samuel-hochstetler-rosanna-kinsinger-ohio-amish-man-charged-with-murder-after-woman-found-dead-with-goat-cincinnati-montgomery-county-coroners-office-dye-road-gallia-county-jail-crime-criminal-activity-rutland-preliminary-results-autopsy-investigation,rodolphoteardrop,2025-07-02 11:30:44,2025-07-02 10:34:10.005183
nottheonion,Billie Joe Armstrong Kicks Fan Offstage for Playing Oasis Instead of Green Day,1277,https://consequence.net/2025/07/green-day-billie-joe-armstrong-fan-plays-oasis/,drfsupercenter,2025-07-01 17:46:40,2025-07-02 10:34:10.005183
nottheonion,US sprinter gets modeling offer after penis fell out of shorts during race,172,https://www.themirror.com/sport/other-sport/chris-robinson-sprinter-penis-underwear-1236778,Bigringcycling,2025-07-02 04:21:38,2025-07-02 10:34:10.005183
nottheonion,Elderly woman killed after confronting man over public urination,29,https://www.hindustantimes.com/cities/lucknow-news/elderly-woman-killed-after-confronting-man-over-public-urination-101742756556463.html,NeckGreedy4130,2025-07-02 13:26:19,2025-07-02 10:34:10.005183
memes,r/Memes is looking for new moderators! Interested? Fill out our application!,8,https://docs.google.com/forms/d/e/1FAIpQLSfBlrL6LVOktwIdGubvbJ7REeh9vANiBTIpUecW63PHINQECg/viewform,dovedevic,2025-06-23 02:20:56,2025-07-02 10:34:10.005183
memes,Inspired meme from the r/genz sub,28059,https://i.redd.it/tk40cq6q1gaf1.png,JokerExo,2025-07-02 11:09:54,2025-07-02 10:34:10.005183
memes,"Remember kids, if buying isn’t legally owning, then pirating ISNT ILLEGALLY owning",4771,https://i.redd.it/vk4rpvw8mfaf1.jpeg,LowerEquipment1013,2025-07-02 09:43:07,2025-07-02 10:34:10.005183
memes,Go go gadget free education,2170,https://i.redd.it/4jv1op3aegaf1.jpeg,Internal-Rice-7900,2025-07-02 12:20:14,2025-07-02 10:34:10.005183
memes,Never felt so old,8589,https://i.redd.it/eqa3fmaatdaf1.png,Sniper_One77,2025-07-02 03:39:01,2025-07-02 10:34:10.005183
memes,No AC is specifically a UK problem,1163,https://i.redd.it/yy9joflckgaf1.jpeg,randomname_99223,2025-07-02 12:54:15,2025-07-02 10:34:10.005183
memes,Not to them at least,1611,https://i.redd.it/ajbndq45kfaf1.gif,MelonInDisguise,2025-07-02 09:31:20,2025-07-02 10:34:10.005183
memes,Why always?,3108,https://i.redd.it/9guo20arheaf1.jpeg,elasticBOWL,2025-07-02 05:56:09,2025-07-02 10:34:10.005183
memes,Everyone’s a moral saint until they actually feel what a billion is,1415,https://i.redd.it/xzw5aecnzeaf1.jpeg,CuteReputation-,2025-07-02 07:36:27,2025-07-02 10:34:10.005183
memes,How true is this?,401,https://i.redd.it/41ox8915ugaf1.jpeg,Dear-Ad-8540,2025-07-02 13:49:11,2025-07-02 10:34:10.005183
memes,Stop Killing Games initiative jumping up by 25% in the course of a couple days,4694,https://i.redd.it/2u5kodx0ocaf1.jpeg,AliOskiTheHoly,2025-07-01 23:49:03,2025-07-02 10:34:10.005183
memes,You don't want to meet me.,1010,https://i.redd.it/kxk1k1z8aeaf1.jpeg,Lily_bloomssss,2025-07-02 05:14:05,2025-07-02 10:34:10.005183
memes,Seen it happen,14336,https://v.redd.it/vpopkng4vaaf1,kylepownu,2025-07-01 17:43:57,2025-07-02 10:34:10.005183
memes,Back to the stone ages,12855,https://i.redd.it/45ya7yof5baf1.jpeg,B0r3dGamer,2025-07-01 18:41:45,2025-07-02 10:34:10.005183
memes,Narcissism =/= Likeable,16531,https://i.redd.it/ok5ycdj2naaf1.jpeg,Just-J0k1ng,2025-07-01 16:58:49,2025-07-02 10:34:10.005183
memes,Big sploosh,38274,https://i.redd.it/ok9edftqy9af1.jpeg,ObjectiveOk2072,2025-07-01 14:42:27,2025-07-02 10:34:10.005183
memes,Thats profit,4391,https://i.redd.it/f23qpm2rpbaf1.gif,Anurag2199,2025-07-01 20:35:39,2025-07-02 10:34:10.005183
memes,If you know you know,5050,https://i.redd.it/zzz8ruzhdbaf1.jpeg,Helpful-Primary6268,2025-07-01 19:26:57,2025-07-02 10:34:10.005183
memes,A total waste of time,1111,https://i.redd.it/x7k6w5pmgdaf1.jpeg,666thSuprisedPikachu,2025-07-02 02:28:03,2025-07-02 10:34:10.005183
memes,Take that inspirational quotes!,894,https://i.redd.it/yo3hoyoiidaf1.png,man-eater13,2025-07-02 02:38:44,2025-07-02 10:34:10.005183
PublicFreakout,Rule 1 of this subreddit: why it exists.,2697,https://v.redd.it/f5u435ljyrfe1,ohhyouknow,2025-01-28 18:05:44,2025-07-02 10:34:10.005183
PublicFreakout,Mind how you are voting because Reddit is about to start spanking folks for votes.,1072,/r/RedditSafety/comments/1j4cd53/warning_users_that_upvote_violent_content/,ohhyouknow,2025-03-06 17:26:39,2025-07-02 10:34:10.005183
PublicFreakout,ICE traumatizing a Family,3616,https://v.redd.it/eeqov8188gaf1,MrDonMega,2025-07-02 11:46:40,2025-07-02 10:34:10.005183
PublicFreakout,"Scalise: ""The 35-year-old who's sitting in his mom's basement playing video games is gonna have to go get a job again.""",2605,https://v.redd.it/thbohfmc5faf1,icey_sawg0034,2025-07-02 08:08:28,2025-07-02 10:34:10.005183
PublicFreakout,She votes.,815,https://v.redd.it/rr0gp9snrgaf1,WTAF__Trump,2025-07-02 13:35:15,2025-07-02 10:34:10.005183
PublicFreakout,"After experiencing road rage, an Italian cyclist began attacking pedestrians, but gets instant karma",1023,https://v.redd.it/7p7gohphdgaf1,TappetoImperiale,2025-07-02 12:15:50,2025-07-02 10:34:10.005183
PublicFreakout,"Someone on X posted their neighbor confronting them for loudly listening to AI translated Hitler speeches in his backyard, and thought people would take his side 😂😂😂 Shoutout to this common sense neighbor",15198,https://v.redd.it/m7t8ry39icaf1,Subject-Property-343,2025-07-01 23:16:09,2025-07-02 10:34:10.005183
PublicFreakout,Post Malone falls off stage while reaching out to toast a fan during concert,4396,https://v.redd.it/q4pwifbjqdaf1,Desperate-Emu4297,2025-07-02 03:23:36,2025-07-02 10:34:10.005183
PublicFreakout,U.S. Senator Chris Murphy has some feels about the Big Horrible Bill..,5609,https://v.redd.it/kns1p9xuadaf1,PrismPhoneService,2025-07-02 01:56:14,2025-07-02 10:34:10.005183
PublicFreakout,Alaskan Sen. Murkowski interviewed after voting for bill to pull Medicaid from 80 million Americans,15976,https://v.redd.it/njenf3823baf1,RoachedCoach,2025-07-01 18:29:29,2025-07-02 10:34:10.005183
PublicFreakout,"Trump calls for deporting US citizens: ""We also have a lot of bad people that have been here for a long time ... many of them were born in our country. I think we ought to get them the hell out of here too, if you want to know the truth. So maybe that'll be the next job.""",18605,https://v.redd.it/bjmguqf2laaf1,ExactlySorta,2025-07-01 16:47:35,2025-07-02 10:34:10.005183
PublicFreakout,Judge calls out guy's shirt choice.,863,https://v.redd.it/z8evd5fx6eaf1,One-Pop-2885,2025-07-02 04:55:28,2025-07-02 10:34:10.005183
PublicFreakout,Trump supporters being deported,18532,https://v.redd.it/4hpve2r2z9af1,MrDonMega,2025-07-01 14:44:20,2025-07-02 10:34:10.005183
PublicFreakout,"A man posing as a U.S. Marshal tried to rob a Cuban immigrant in Houston, TX. But, he didn't count on the victim's wife being armed and dangerous.",6073,https://v.redd.it/huq5jia82baf1,MobileWisdom,2025-07-01 18:24:41,2025-07-02 10:34:10.005183
PublicFreakout,"Trump in an ICE detention center: ""Biden wanted me in here, that son of a (redacted).""",3668,https://v.redd.it/kb04u6y2nbaf1,CantStopPoppin,2025-07-01 20:21:18,2025-07-02 10:34:10.005183
PublicFreakout,"English guy snatches Palestinian flag, only to drop his phone.",9900,https://v.redd.it/nnvygj9j9aaf1,SignalHD18,2025-07-01 15:43:01,2025-07-02 10:34:10.005183
PublicFreakout,"A fireworks warehouse exploding today near Sacramento, CA",586,https://v.redd.it/ncoksfyc6eaf1,Desperate-Emu4297,2025-07-02 04:52:24,2025-07-02 10:34:10.005183
PublicFreakout,Neighbour had a long day at work and her bf smoked her last joint (not my video),127,https://v.redd.it/ekaegorlkgaf1,Kitchen-Article4439,2025-07-02 12:55:42,2025-07-02 10:34:10.005183
PublicFreakout,"I'll kill you b**** and your mother f****** family! Bedford Ave Brooklyn, New York",86,https://v.redd.it/v45dshzqtgaf1,nycsellit4me,2025-07-02 13:46:57,2025-07-02 10:34:10.005183
PublicFreakout,Celebrating a Genocide.,2123,https://v.redd.it/kwfjwfa6gbaf1,Charming-Duck5178,2025-07-01 19:42:15,2025-07-02 10:34:10.005183
Wellthatsucks,My favorite water bottle was not dishwasher safe (It used to be a gallon),24130,https://i.redd.it/nx2qqonz6caf1.jpeg,LordNikoli,2025-07-01 22:12:16,2025-07-02 10:34:10.005183
Wellthatsucks,Went to my storage unit for the first time in a year. I have to throw everything out now.,4309,https://www.reddit.com/gallery/1lplsqi,Ok_Ordinary2191,2025-07-02 03:36:35,2025-07-02 10:34:10.005183
Wellthatsucks,I thought this plastic on my new washer was a protective film,6791,https://i.redd.it/zei6soy78caf1.jpeg,Charming-Passion-178,2025-07-01 22:19:09,2025-07-02 10:34:10.005183
Wellthatsucks,Got diagnosed with type 2 diabetes,499,https://i.redd.it/1t7ij0kmrfaf1.jpeg,CrazyCatLady9777,2025-07-02 10:13:16,2025-07-02 10:34:10.005183
