subreddit,title,score,url,author,created_utc,extracted_at
Home,Which one?,4,https://www.reddit.com/gallery/1lpuz8p,mwah_wah,2025-07-02 12:48:40,2025-07-02 10:34:10.005183
Home,"Just bought this home, first time home owner, what can I do to save/revive my yard? No sprinklers installed. No budget for that right now. I only have time to water every 3-4 days with some area sprinklers. Low to no humidity most days.",23,https://i.redd.it/23u7dhf20daf1.jpeg,GuacaMolis6,2025-07-02 00:55:13,2025-07-02 10:34:10.005183
Home,How do I fix this dryer vent?,8,https://i.redd.it/kojw5r845eaf1.jpeg,o50851515,2025-07-02 04:45:19,2025-07-02 10:34:10.005183
Home,Downspout,19,https://i.redd.it/dojj09nuvcaf1.jpeg,dogwhisp,2025-07-02 00:31:37,2025-07-02 10:34:10.005183
Home,Sump pump weird?!,5,https://v.redd.it/yqtemmlwmeaf1,bitter421979,2025-07-02 06:28:49,2025-07-02 10:34:10.005183
Home,What kind of attachment do I need for this spigot?,28,https://www.reddit.com/gallery/1lp9fwu,catsorpiebald,2025-07-01 18:30:16,2025-07-02 10:34:10.005183
Home,What are these?,2,https://www.reddit.com/gallery/1lpprgx,ArrivalEmpty,2025-07-02 07:36:55,2025-07-02 10:34:10.005183
Home,"Wood rot in basement, who to call?",4,https://www.reddit.com/gallery/1lpl80x,Significant_Shoe_572,2025-07-02 03:06:16,2025-07-02 10:34:10.005183
Home,"bosh stove; question if it is heating safely, has a lot of rust buildup",2,https://www.reddit.com/gallery/1lpogbx,juicycali,2025-07-02 06:11:02,2025-07-02 10:34:10.005183
Home,Do I need to be worried,9,https://www.reddit.com/gallery/1lpfd2h,CertainTop4172,2025-07-01 22:24:07,2025-07-02 10:34:10.005183
Home,Help! Three exposed edges.  Redoing the tile. How would you edge this? No one seems to agree,0,https://i.redd.it/dxbdgifokfaf1.jpeg,thelionofverdun,2025-07-02 09:34:18,2025-07-02 10:34:10.005183
Home,Help with light bill,1,https://www.reddit.com/r/Home/comments/1lpr0xs/help_with_light_bill/,PriorityChemical5974,2025-07-02 09:04:35,2025-07-02 10:34:10.005183
Home,Is a wax stick going to be enough to fill this gouge?,2,https://i.redd.it/xxeeg3m72eaf1.jpeg,knoll126,2025-07-02 04:29:01,2025-07-02 10:34:10.005183
Home,French drain or Stepping Stones?,3,https://www.reddit.com/gallery/1lpfccq,Strong_Tree9410,2025-07-01 22:23:13,2025-07-02 10:34:10.005183
Home,Is this wood siding being permanently damaged by pressure washing?,259,https://www.reddit.com/gallery/1lomukt,FatStacks2020,2025-06-30 23:37:25,2025-07-02 10:34:10.005183
Home,Does anyone know how to open this door without key please :),0,https://www.reddit.com/gallery/1lpnu76,KaleidoscopeIll976,2025-07-02 05:32:54,2025-07-02 10:34:10.005183
Home,Photo frames with generic picture from store still in them,1,https://www.reddit.com/r/Home/comments/1lpmrl2/photo_frames_with_generic_picture_from_store/,Agitated-Classic-301,2025-07-02 04:29:49,2025-07-02 10:34:10.005183
Home,Sorry a better picture of the infamous spigot — with a ruler. Guess on size?,0,https://i.redd.it/wyavd2b71eaf1.jpeg,thelionofverdun,2025-07-02 04:23:22,2025-07-02 10:34:10.005183
Home,Laundry room pipe,0,https://i.redd.it/6bw43w4n0eaf1.jpeg,OvenSuspicious9008,2025-07-02 04:20:13,2025-07-02 10:34:10.005183
Home,"Please help, I messed up my countertop!",1,https://www.reddit.com/r/Home/comments/1lpl7ya/please_help_i_messed_up_my_countertop/,mambi85,2025-07-02 03:06:10,2025-07-02 10:34:10.005183
AskReddit,What is your secret for more enjoyable sex?,764,https://www.reddit.com/r/AskReddit/comments/1lpqdei/what_is_your_secret_for_more_enjoyable_sex/,Therealone30,2025-07-02 08:19:42,2025-07-02 10:34:10.005183
AskReddit,What’s the most impactful thing in the world right now but no one is talking about it?,333,https://www.reddit.com/r/AskReddit/comments/1lptqil/whats_the_most_impactful_thing_in_the_world_right/,Radiant-War-9984,2025-07-02 11:47:28,2025-07-02 10:34:10.005183
AskReddit,"People who have worked for the ultrawealthy, what are some of their deepest, darkest secrets?",5129,https://www.reddit.com/r/AskReddit/comments/1lpcw0z/people_who_have_worked_for_the_ultrawealthy_what/,clitical-rolls,2025-07-01 20:43:37,2025-07-02 10:34:10.005183
AskReddit,"The Senate just passed the Big Beautiful Bill today, What's your reaction to this?",18246,https://www.reddit.com/r/AskReddit/comments/1lp6ldr/the_senate_just_passed_the_big_beautiful_bill/,Squirrelkid11,2025-07-01 16:43:04,2025-07-02 10:34:10.005183
AskReddit,What are the things that instantly make you hate someone?,231,https://www.reddit.com/r/AskReddit/comments/1lptbwv/what_are_the_things_that_instantly_make_you_hate/,Disastrous-Desk6322,2025-07-02 11:25:59,2025-07-02 10:34:10.005183
AskReddit,What’s a basic skill you’re shocked some adults still don’t know?,519,https://www.reddit.com/r/AskReddit/comments/1lpodyl/whats_a_basic_skill_youre_shocked_some_adults/,Mirukuyobi,2025-07-02 06:06:56,2025-07-02 10:34:10.005183
AskReddit,What celebrity do you think hasn't realized they aren't popular anymore?,4036,https://www.reddit.com/r/AskReddit/comments/1lp8ren/what_celebrity_do_you_think_hasnt_realized_they/,Sufficient_Duck7715,2025-07-01 18:04:17,2025-07-02 10:34:10.005183
AskReddit,What would you say is the number one reason for sexless marriages?,1330,https://www.reddit.com/r/AskReddit/comments/1lpgwok/what_would_you_say_is_the_number_one_reason_for/,secret_-outlet,2025-07-01 23:33:29,2025-07-02 10:34:10.005183
AskReddit,What is currently on the brink of collapse but no one is talking about it?,1688,https://www.reddit.com/r/AskReddit/comments/1lpdkrz/what_is_currently_on_the_brink_of_collapse_but_no/,RiverVixn,2025-07-01 21:10:22,2025-07-02 10:34:10.005183
AskReddit,"You’re sitting at the bar and death walks in. He sits next to you, and says, “Finish your drink, it’s time to go.” How are you responding?",808,https://www.reddit.com/r/AskReddit/comments/1lpiec7/youre_sitting_at_the_bar_and_death_walks_in_he/,FU5ION01,2025-07-02 00:44:12,2025-07-02 10:34:10.005183
AskReddit,"As today is Canada Day, how do you feel about Canada, and what comes to mind when you think of Canada?",432,https://www.reddit.com/r/AskReddit/comments/1lplzrx/as_today_is_canada_day_how_do_you_feel_about/,td192020,2025-07-02 03:47:21,2025-07-02 10:34:10.005183
AskReddit,"What screams ""I am insecure"" but most people don't notice?",1521,https://www.reddit.com/r/AskReddit/comments/1lpcs4q/what_screams_i_am_insecure_but_most_people_dont/,SCYTHE_11,2025-07-01 20:39:17,2025-07-02 10:34:10.005183
AskReddit,What was your first phone?,118,https://www.reddit.com/r/AskReddit/comments/1lps4q8/what_was_your_first_phone/,janta_station,2025-07-02 10:16:07,2025-07-02 10:34:10.005183
AskReddit,What’s a subtle sign someone is rich but hiding it?,8430,https://www.reddit.com/r/AskReddit/comments/1loz54f/whats_a_subtle_sign_someone_is_rich_but_hiding_it/,Againmrbrown,2025-07-01 11:25:54,2025-07-02 10:34:10.005183
AskReddit,"If sex was treated like a job interview, what's one question that would immediately disqualify eighty percent of people?",58,https://www.reddit.com/r/AskReddit/comments/1lpvh85/if_sex_was_treated_like_a_job_interview_whats_one/,jasonclarke1902,2025-07-02 13:11:03,2025-07-02 10:34:10.005183
AskReddit,Women what makes a man instantly unattractive to you?,3856,https://www.reddit.com/r/AskReddit/comments/1lp2vu4/women_what_makes_a_man_instantly_unattractive_to/,sphinctersayswhat9,2025-07-01 14:19:04,2025-07-02 10:34:10.005183
AskReddit,What's yalls opinion on wisdom teeth?,60,https://www.reddit.com/r/AskReddit/comments/1lpupax/whats_yalls_opinion_on_wisdom_teeth/,Actual_Banned37,2025-07-02 12:35:38,2025-07-02 10:34:10.005183
AskReddit,What's a lie you tell yourself daily?,68,https://www.reddit.com/r/AskReddit/comments/1lpta1i/whats_a_lie_you_tell_yourself_daily/,CallResponsible9107,2025-07-02 11:23:09,2025-07-02 10:34:10.005183
AskReddit,What’s the most silent form of disrespect?,101,https://www.reddit.com/r/AskReddit/comments/1lpqm96/whats_the_most_silent_form_of_disrespect/,Hrithik_Ki_Patni,2025-07-02 08:36:54,2025-07-02 10:34:10.005183
AskReddit,How did the intensity of sex with your significant other change as time went on in your relationship?,1846,https://www.reddit.com/r/AskReddit/comments/1lp6qxw/how_did_the_intensity_of_sex_with_your/,Hot-Researcher2831,2025-07-01 16:49:04,2025-07-02 10:34:10.005183
NoStupidQuestions,U.S. Politics megathread,1,https://www.reddit.com/r/NoStupidQuestions/comments/1los5a7/us_politics_megathread/,AutoModerator,2025-07-01 04:02:42,2025-07-02 10:34:10.005183
NoStupidQuestions,Middle East Conflicts 2025 Megathread,16,https://www.reddit.com/r/NoStupidQuestions/comments/1lhowyj/middle_east_conflicts_2025_megathread/,AutoModerator,2025-06-22 14:15:33,2025-07-02 10:34:10.005183
NoStupidQuestions,"Is “death grip” always the issue, or do some men just not cum naturally from penetrative sex?",1144,https://www.reddit.com/r/NoStupidQuestions/comments/1lpogud/is_death_grip_always_the_issue_or_do_some_men/,stupid-mess,2025-07-02 06:12:00,2025-07-02 10:34:10.005183
NoStupidQuestions,What is the women's equivalent of getting your penis stuck in a zipper?,676,https://www.reddit.com/r/NoStupidQuestions/comments/1lpq3ga/what_is_the_womens_equivalent_of_getting_your/,SummerClamSadness,2025-07-02 08:00:22,2025-07-02 10:34:10.005183
NoStupidQuestions,"Why didn't religious white Christians during the era of slavery think that if people came from Adam and Eve, then blacks and whites were one and brothers?",630,https://www.reddit.com/r/NoStupidQuestions/comments/1lppsq6/why_didnt_religious_white_christians_during_the/,Kian_568,2025-07-02 07:39:21,2025-07-02 10:34:10.005183
NoStupidQuestions,What’s stopping someone from laundering money by just depositing a couple thousand dollars a month into the bank?,2079,https://www.reddit.com/r/NoStupidQuestions/comments/1lpf8jk/whats_stopping_someone_from_laundering_money_by/,HrnyRedditor,2025-07-01 22:18:45,2025-07-02 10:34:10.005183
NoStupidQuestions,ELI5:How after 5000 years of humanity surviving off of bread do we have so many people within the last decade who are entirely allergic to gluten?,236,https://www.reddit.com/r/NoStupidQuestions/comments/1lprps6/eli5how_after_5000_years_of_humanity_surviving/,Jurekkie,2025-07-02 09:50:20,2025-07-02 10:34:10.005183
NoStupidQuestions,Why do spare tires have to be special emergency tires?,168,https://www.reddit.com/r/NoStupidQuestions/comments/1lpt33v/why_do_spare_tires_have_to_be_special_emergency/,kein_lust,2025-07-02 11:12:40,2025-07-02 10:34:10.005183
NoStupidQuestions,"If a unlicensed underage driver had to drive someone to the hospital, and did so perfectly, would they face prosecution l?",1104,https://www.reddit.com/r/NoStupidQuestions/comments/1lpi18o/if_a_unlicensed_underage_driver_had_to_drive/,peterbilt_378,2025-07-02 00:26:05,2025-07-02 10:34:10.005183
NoStupidQuestions,"If sound can’t travel through a vacuum, how is NASA able to share those eerie “sounds” of black holes and distant planets what am I actually hearing in those recordings?",1255,https://www.reddit.com/r/NoStupidQuestions/comments/1lpeh3h/if_sound_cant_travel_through_a_vacuum_how_is_nasa/,Second-handBonding,2025-07-01 21:47:03,2025-07-02 10:34:10.005183
NoStupidQuestions,"Why are peanut allergies so common in USA, but country like India has virtually none?",3512,https://www.reddit.com/r/NoStupidQuestions/comments/1lp5rjt/why_are_peanut_allergies_so_common_in_usa_but/,HazardousHacker,2025-07-01 16:11:41,2025-07-02 10:34:10.005183
NoStupidQuestions,Does the average American know that today is Canada’s birthday?,1474,https://www.reddit.com/r/NoStupidQuestions/comments/1lp76z5/does_the_average_american_know_that_today_is/,DoubleDDay69,2025-07-01 17:05:29,2025-07-02 10:34:10.005183
NoStupidQuestions,"American food is called unhealthy for myriad of reasons such as: additives, “toxins”, chemicals, and others. What exactly are these specific substances that make American food “unhealthy”",870,https://www.reddit.com/r/NoStupidQuestions/comments/1lpamiz/american_food_is_called_unhealthy_for_myriad_of/,PeterThielWorshipper,2025-07-01 19:15:12,2025-07-02 10:34:10.005183
NoStupidQuestions,"Fellas how do you recover from your pecker ""chickening out"", during intimacy?",740,https://www.reddit.com/r/NoStupidQuestions/comments/1lpa4jd/fellas_how_do_you_recover_from_your_pecker/,Tekigami,2025-07-01 18:56:23,2025-07-02 10:34:10.005183
NoStupidQuestions,"A lot of women dislike when their male friend asks them out, but they also don't like being approached by strangers and men they don't know. So when is it ok to ask a woman out?",1645,https://www.reddit.com/r/NoStupidQuestions/comments/1lp37wa/a_lot_of_women_dislike_when_their_male_friend/,ThunderStroke90,2025-07-01 14:32:50,2025-07-02 10:34:10.005183
NoStupidQuestions,"Why do dogs instantly know when you're putting on ""real shoes"" instead of flip-flops?",597,https://www.reddit.com/r/NoStupidQuestions/comments/1lpa14g/why_do_dogs_instantly_know_when_youre_putting_on/,AcademicInitial5984,2025-07-01 18:52:51,2025-07-02 10:34:10.005183
NoStupidQuestions,Are plushies/stuffed animal girls a turn off?,56,https://www.reddit.com/r/NoStupidQuestions/comments/1lppuir/are_plushiesstuffed_animal_girls_a_turn_off/,NervousStock2241,2025-07-02 07:42:48,2025-07-02 10:34:10.005183
NoStupidQuestions,Why does “attempted murder” get a lower sentence than murder? Why should a criminal be awarded for their incompetence?,5651,https://www.reddit.com/r/NoStupidQuestions/comments/1loum83/why_does_attempted_murder_get_a_lower_sentence/,Targ_Hunter,2025-07-01 06:32:00,2025-07-02 10:34:10.005183
NoStupidQuestions,"In the US, you escape jail/prison/holding and you prove your innocence while out, will you be punished for escaping?",312,https://www.reddit.com/r/NoStupidQuestions/comments/1lpef2f/in_the_us_you_escape_jailprisonholding_and_you/,Jrolaoni,2025-07-01 21:44:50,2025-07-02 10:34:10.005183
NoStupidQuestions,What's the opposite of the Women Jogging Test?,14655,https://www.reddit.com/r/NoStupidQuestions/comments/1loqpdl/whats_the_opposite_of_the_women_jogging_test/,alexkuul,2025-07-01 02:46:03,2025-07-02 10:34:10.005183
BaldursGate3,Tav Tuesday,7,https://www.reddit.com/r/BaldursGate3/comments/1los4g6/tav_tuesday/,AutoModerator,2025-07-01 04:01:33,2025-07-02 10:34:10.005183
BaldursGate3,"WEEKLY HELP THREAD - READ FAQ, COMMUNITY WIKI, MULTICLASSING, LORE",6,https://www.reddit.com/r/BaldursGate3/comments/1lkqh1a/weekly_help_thread_read_faq_community_wiki/,XFearthePandaX,2025-06-26 04:00:51,2025-07-02 10:34:10.005183
BaldursGate3,line deliveries that go crazy for no reason,999,https://www.reddit.com/r/BaldursGate3/comments/1lplj5v/line_deliveries_that_go_crazy_for_no_reason/,cheoldyke,2025-07-02 03:22:25,2025-07-02 10:34:10.005183
BaldursGate3,You can kill certain cambion using Atrophied condition,570,https://www.reddit.com/gallery/1lpnzgw,NnmnsP,2025-07-02 05:41:57,2025-07-02 10:34:10.005183
BaldursGate3,Which spell is this for you?,10446,https://i.redd.it/weppnw8f0aaf1.jpeg,TerrorOfDeath97,2025-07-01 14:52:28,2025-07-02 10:34:10.005183
BaldursGate3,The reveal about the Emperor caught me off guard,112,https://www.reddit.com/r/BaldursGate3/comments/1lptxyz/the_reveal_about_the_emperor_caught_me_off_guard/,SnowingRain320,2025-07-02 11:58:13,2025-07-02 10:34:10.005183
BaldursGate3,Best transformation/2nd phase in the game?,1065,https://www.reddit.com/gallery/1lpgk8s,GamerLvl69,2025-07-01 23:17:41,2025-07-02 10:34:10.005183
BaldursGate3,Karlach doesn’t recognize Gortash?,415,https://www.reddit.com/r/BaldursGate3/comments/1lpmaby/karlach_doesnt_recognize_gortash/,Comprehensive_Cap290,2025-07-02 04:03:07,2025-07-02 10:34:10.005183
BaldursGate3,Do Not pickpocket the main mushroom,109,https://i.redd.it/cjv9452btfaf1.jpeg,llamallama92,2025-07-02 10:22:40,2025-07-02 10:34:10.005183
BaldursGate3,Is it possible to kill murder lady immediately in Act 3?,260,https://www.reddit.com/r/BaldursGate3/comments/1lpnlhu/is_it_possible_to_kill_murder_lady_immediately_in/,ChaosBerserker666,2025-07-02 05:18:09,2025-07-02 10:34:10.005183
BaldursGate3,I know Minthara is evil... but...,112,https://i.redd.it/8plgkscl8faf1.jpeg,Illustrious_Cost2945,2025-07-02 08:28:18,2025-07-02 10:34:10.005183
BaldursGate3,Drunken Master Monk is an absolute melee powerhouse,53,https://i.redd.it/xs4y0bpvxfaf1.jpeg,Uncle-Petey87,2025-07-02 10:48:24,2025-07-02 10:34:10.005183
BaldursGate3,I somehow got Zombie Minthara to join,98,https://www.reddit.com/r/BaldursGate3/comments/1lpow5o/i_somehow_got_zombie_minthara_to_join/,JudyluvsV,2025-07-02 06:39:55,2025-07-02 10:34:10.005183
BaldursGate3,Uhh...no thank you,414,https://i.redd.it/a8bmzfhk2caf1.jpeg,stonedreyna,2025-07-01 21:47:27,2025-07-02 10:34:10.005183
BaldursGate3,Just use Otiluke's Resilient Sphere,250,https://www.reddit.com/r/BaldursGate3/comments/1lphycd/just_use_otilukes_resilient_sphere/,Cultural_Spell_4483,2025-07-02 00:22:08,2025-07-02 10:34:10.005183
BaldursGate3,I used Seeming on Orpheus....,798,https://i.redd.it/tw7sryuuyaaf1.jpeg,TheOldSchlGmr,2025-07-01 18:04:52,2025-07-02 10:34:10.005183
BaldursGate3,T’chk….you forgot my fries,43,https://i.redd.it/ttp4bip8hfaf1.jpeg,tired-moth,2025-07-02 09:15:04,2025-07-02 10:34:10.005183
BaldursGate3,Splitscreen makes it a bit awkward,1420,https://i.redd.it/o43tlp81f9af1.png,Boshwa,2025-07-01 12:52:08,2025-07-02 10:34:10.005183
BaldursGate3,This reminds me of how I treated a certain quest in Act 3,54,https://v.redd.it/lf2y9wn9udaf1,becauseofwhen,2025-07-02 06:10:24,2025-07-02 10:34:10.005183
BaldursGate3,Revify Out of Range?,98,https://i.redd.it/nn6vebweldaf1.jpeg,PanPanReddit,2025-07-02 02:54:52,2025-07-02 10:34:10.005183
facepalm,The fact he had to make this statement.,5858,https://i.redd.it/ax8ddctwwfaf1.jpeg,c-k-q99903,2025-07-02 10:42:53,2025-07-02 10:34:10.005183
facepalm,"Dance, puppet, dance",3203,https://i.redd.it/4qnk15ss5gaf1.jpeg,ExactlySorta,2025-07-02 11:32:41,2025-07-02 10:34:10.005183
facepalm,Disabled seniors zip-tied by cops while protesting Trump's cuts to Medicaid.,2530,https://www.reddit.com/gallery/1lpuhtj,Vloodzy,2025-07-02 12:25:35,2025-07-02 10:34:10.005183
facepalm,“I hold all the levers” 🙄,1878,https://i.redd.it/q46tp6lkogaf1.jpeg,MundaneMeringue71,2025-07-02 13:17:55,2025-07-02 10:34:10.005183
facepalm,"All because 813 billionaires want even more - all, in fact",1058,https://i.redd.it/kqj4z3wltgaf1.jpeg,ExactlySorta,2025-07-02 13:46:08,2025-07-02 10:34:10.005183
facepalm,"What goes around, comes around.",14908,https://i.redd.it/51ig79l5ucaf1.png,GigiL4,2025-07-02 00:23:56,2025-07-02 10:34:10.005183
facepalm,Hypocrisy at its best!,1515,https://i.redd.it/ishk3dndlfaf1.jpeg,tecnogamer,2025-07-02 09:38:14,2025-07-02 10:34:10.005183
facepalm,"""Conservative Christians "" are you there?",3051,https://i.redd.it/bd6r365sheaf1.jpeg,Nice_Substance9123,2025-07-02 05:56:19,2025-07-02 10:34:10.005183
facepalm,Investing In Punishments.,4750,https://i.redd.it/p8hwgco3mdaf1.png,Monsur_Ausuhnom,2025-07-02 02:58:48,2025-07-02 10:34:10.005183
facepalm,I was truly taken aback,3404,https://i.redd.it/5brobol5ydaf1.jpeg,GlitteryPixieDust,2025-07-02 04:06:17,2025-07-02 10:34:10.005183
facepalm,Two faced,7299,https://i.redd.it/heorj8h6jcaf1.jpeg,tecnogamer,2025-07-01 23:20:33,2025-07-02 10:34:10.005183
facepalm,"Trump has donated a new portrait to Colorado’s Gallery of Presidents, after demanding the original be replaced for being “purposefully distorted.”",7650,https://i.redd.it/nrrj2qjmbcaf1.jpeg,Rya_Bz,2025-07-01 22:38:13,2025-07-02 10:34:10.005183
facepalm,These are the parents of the Idaho shooter Wess Roley. Need I say more?,13420,https://www.reddit.com/gallery/1lp8l2k,Vloodzy,2025-07-01 17:57:57,2025-07-02 10:34:10.005183
facepalm,The Mind Boggles!,13903,https://i.redd.it/nofrxqg9yaaf1.jpeg,reincarnatedusername,2025-07-01 18:02:48,2025-07-02 10:34:10.005183
facepalm,"GOP hoping Americans are gullible enough to still believe in ""trickle-down"" economics",242,https://i.redd.it/tdcr9h5aigaf1.png,Stravok182,2025-07-02 12:42:39,2025-07-02 10:34:10.005183
facepalm,Pathetic cowards,13113,https://i.redd.it/qxbi27y1gaaf1.jpeg,ExactlySorta,2025-07-01 16:19:29,2025-07-02 10:34:10.005183
facepalm,Ok GOP W.T.F,263,https://i.redd.it/yqm8a3qnufaf1.jpeg,Bourbon-Thinker,2025-07-02 10:30:15,2025-07-02 10:34:10.005183
facepalm,"Are they really, Nancy?",746,https://i.redd.it/x2lfpfpm4eaf1.jpeg,N4TETHAGR8,2025-07-02 04:42:35,2025-07-02 10:34:10.005183
facepalm,Trump: “Biden wanted me here… that son of a bitch.”,7526,https://i.redd.it/0ozhj6ggmaaf1.jpeg,N4TETHAGR8,2025-07-01 16:55:22,2025-07-02 10:34:10.005183
facepalm,"To be this backwards, 🤦🏽‍♂️",2055,https://i.redd.it/wfh895epdcaf1.jpeg,RoloGnbaby,2025-07-01 22:49:53,2025-07-02 10:34:10.005183
interestingasfuck,A CAMEL'S REACTION WHEN IT SEES AN OCEAN FOR THE FIRST TIME.,2742,https://v.redd.it/gzymiaeapgaf1,theseeenutzzz,2025-07-02 13:22:03,2025-07-02 10:34:10.005183
interestingasfuck,"In 2018, Tayeb Souami from New Jersey returned a $5 bottle of orange juice after his wife said it was too expensive, he used the refund to buy 2 lottery tickets and checked them at a 7‑Eleven the following day while getting his car washed and won $315 million.",19885,https://i.redd.it/taqvhlus4eaf1.jpeg,Algrinder,2025-07-02 04:43:34,2025-07-02 10:34:10.005183
interestingasfuck,Massive Sheep Suicide,17800,https://i.redd.it/4qsl589k6eaf1.jpeg,AdAdministrative3720,2025-07-02 04:54:53,2025-07-02 10:34:10.005183
interestingasfuck,An aerial view of a controlled burn.,2314,https://v.redd.it/326yo8pcggaf1,Dramatic-Avocado4687,2025-07-02 12:31:52,2025-07-02 10:34:10.005183
interestingasfuck,MIT Entrance Examination Paper from the Year 1869-70,3050,https://i.redd.it/9a2qncyt0gaf1.jpeg,Yournewbestfriend_01,2025-07-02 11:04:51,2025-07-02 10:34:10.005183
interestingasfuck,Medics of ISLE OF MAN TT!,3121,https://v.redd.it/10auipc4rfaf1,Adventurous_Bhullar,2025-07-02 10:10:54,2025-07-02 10:34:10.005183
interestingasfuck,"YouTuber Max Fosh legally ""died"" in order to get a $50 refund from an airline He got a death certificate from a small region in Italy, and it was accepted",24417,https://i.redd.it/2zbhfotbxcaf1.jpeg,beekay8845,2025-07-02 00:39:53,2025-07-02 10:34:10.005183
interestingasfuck,"""La Boule"" dinnerware set",861,https://v.redd.it/50c00ablqgaf1,Holadola,2025-07-02 13:29:19,2025-07-02 10:34:10.005183
interestingasfuck,Scientist with nerves of steel collecting Giant Asian Hornets known to have one of the most painful stings.,11496,https://v.redd.it/ey0tmglewcaf1,TravelEffective5558,2025-07-02 00:35:34,2025-07-02 10:34:10.005183
interestingasfuck,"Only 1,280 Survived: The Near-Extinction Event That Nearly Wiped Out Humanity 1 Million Years Ago",4989,https://dailygalaxy.com/2025/06/only-1280-survived-the-near-extinction-event-that-nearly-wiped-out-humanity-1-million-years-ago/,upyoars,2025-07-02 03:32:28,2025-07-02 10:34:10.005183
interestingasfuck,New viruses identified in bats in China,1614,https://www.livescience.com/health/viruses-infections-disease/new-viruses-identified-in-bats-in-china,upyoars,2025-07-02 08:38:50,2025-07-02 10:34:10.005183
interestingasfuck,A seal finding out lizards exist.,2297,https://v.redd.it/xc7w8lwvbeaf1,AiiRisBanned,2025-07-02 05:23:15,2025-07-02 10:34:10.005183
interestingasfuck,F-16 Pilot Christopher Stricklin Ejects Very Late In Order To Guide The Jet Away From The Spectators.,16898,https://i.redd.it/e68dlvx1abaf1.png,MoazzamDML,2025-07-01 19:07:44,2025-07-02 10:34:10.005183
interestingasfuck,A sneaky cat in Turkey scared the shop owner by secretly moving a box,26508,https://v.redd.it/7y94tzrv2baf1,seyitdev,2025-07-01 18:27:40,2025-07-02 10:34:10.005183
interestingasfuck,An Australian company has created fluorescent road markings for better visibility at night.,6426,https://www.reddit.com/gallery/1lpf6fo,WoundtraxTheGoat,2025-07-01 22:16:17,2025-07-02 10:34:10.005183
interestingasfuck,I guess we know who won..:,54461,https://v.redd.it/18pnfodnpaaf1,Lookingforjoy17,2025-07-01 17:13:17,2025-07-02 10:34:10.005183
interestingasfuck,This was a study conducted by the University of Central Florida on ADHD.,63507,https://v.redd.it/4f7krxsmjaaf1,Greedy-Year8384,2025-07-01 16:39:35,2025-07-02 10:34:10.005183
interestingasfuck,"It takes three months to clean the windows of the Burj Khalifa, but since they're cleaned four times a year, the work never stops",27337,https://v.redd.it/ol1bxj0ufaaf1,theseeenutzzz,2025-07-01 16:18:30,2025-07-02 10:34:10.005183
interestingasfuck,Helicopter made emergency landing on road in India.,554,https://v.redd.it/l5zc7qsl9faf1,H1gh_Tr3ason,2025-07-02 08:32:30,2025-07-02 10:34:10.005183
interestingasfuck,Garnet sand grain set on the eye of a deceased fly,1001,https://i.redd.it/buxf9pqz9eaf1.jpeg,Due-Challenge-9207,2025-07-02 05:12:38,2025-07-02 10:34:10.005183
Damnthatsinteresting,r/Damnthatsinteresting is looking for new mods!,319,https://www.reddit.com/r/Damnthatsinteresting/comments/1hbthof/rdamnthatsinteresting_is_looking_for_new_mods/,esoterix_luke,2024-12-11 13:30:25,2025-07-02 10:34:10.005183
Damnthatsinteresting,"A fireworks warehouse exploding today near Sacramento, CA",42612,https://v.redd.it/lf2y9wn9udaf1,buckets_811,2025-07-02 03:44:32,2025-07-02 10:34:10.005183
Damnthatsinteresting,An elephant stealing a bag of rice and kicking it open to eat,1472,https://v.redd.it/4zdts67lvgaf1,technowise,2025-07-02 13:59:03,2025-07-02 10:34:10.005183
Damnthatsinteresting,"This is the face of a woman who lived 10,500 years ago, reconstructed from her skull and DNA",14435,https://i.redd.it/zypqtcic6daf1.jpeg,Gullible_Top3304,2025-07-02 01:30:25,2025-07-02 10:34:10.005183
Damnthatsinteresting,Her name is Domino and she’s a chimera Britsh shorthair cat from the Netherlands. Credits: queendomiino (IG),2390,https://i.redd.it/mcyytoj94faf1.jpeg,NastyNice1,2025-07-02 08:02:19,2025-07-02 10:34:10.005183
